abbrev	meaning	pāli	example	explanation	ru_abbrev	ru_meaning
3	declined in all three gender					cклоняется во всех трех родах
･	root has verbs which are derived from it					буквы удаленные из конструкции
()	letters deleted from construction		√dhā > <b>(</b>da<b>)</b>h + ita > hita			буквы добавленные в конструкцию
[]	letters added to construction		pari + <b>[</b>y<b>]</b> + √i > āy + *a > pariyāya			указывает усиление гласных
*	vuddhi or vowel strengthening takes place	vuḍḍhi	√bhū + <b>*</b>e > bhāve			указывает на морфологические изменения
×	root has no verbs which are derived from it					обозначение корня
>	indicates morphological change occurs	āpajjate	√ñā + nā <b>></b> jānā			
~	how complete is a word's information?<br/><span class='gray'>✓</span> word data is complete with contextual meaning, grammar, sutta example and other relevant information<br/><span class='gray'>~</span> word data is partially complete with a meaning in context but minimal other information<br/><span class='gray'>✗</span> word data is still under construction					
√	root symbol	dhātu	<b>√</b>bhū 1 a (to be)	A root is the irreducible core meaning of a word, stripped of all affixes		
✓	how complete is a word's information?<br/><span class='gray'>✓</span> word data is complete with contextual meaning, grammar, sutta example and other relevant information<br/><span class='gray'>~</span> word data is partially complete with a meaning in context but minimal other information<br/><span class='gray'>✗</span> word data is still under construction					
✗	how complete is a word's information?<br/><span class='gray'>✓</span> word data is complete with contextual meaning, grammar, sutta example and other relevant information<br/><span class='gray'>~</span> word data is partially complete with a meaning in context but minimal other information<br/><span class='gray'>✗</span> word data is still under construction					
1st	first person	uttama; uttamapurisa	mayaṃ - pron <b>1st</b> nom sg of ahaṃ	I; we	1	первое лицо
2nd	second person	majjhima; majjhimapurisa	ehi - verb imp <b>2nd</b> sg from eti	you; you all	2	второе лицо
3rd	third person	paṭhama; paṭhamapurisa	hontu - verb imp <b>3rd</b> pl from hoti	he; they	3	третье лицо
abbrev	abbreviation				сокращ	сокращённая форма
ABD	Abhidhāna Dictionary			"The Pāḷi Myanmar Abhidhān is the largest Pāḷi dictionary in the world, currently more than 23 volumes in size and including every word in the Mūla and Commentaries. There is currently a project underway to translate the dictionary into English.<br/><a class=""link"" href=""https://github.com/bksubhuti/Tipitaka-Pali-Projector"">inside TPP</a>"		Словарь Абхидхана
abl	ablative case	pañcamī, apādanavacana, avadhi, apādāna, nissakka	tato - pron, <b>abl</b> sg of ta	generally showing separation (from, away from)<br/>(e.g. from that)	отд	отделительный падеж
abs	absolutive verb	avyaya, pubbakicca	upasaṅkamitvā; katvā	A verb, often a combination of having + past participle, expressing completed action (e.g. having approached; having made)	деепр.несов	деепричастие несовершенного вида
abstr	abstract noun		abyāpāda - masc <b>abstr</b>	A concept or idea not associated with any specific instance or any concrete thing (e.g. friendliness)	абстр	абстрактное существительное
acc	accusative case	dutiyā, upayogavacana, kammavacana	maṃ - pron, 1st <b>acc</b> sg	the object of the sentence (e.g. me)	вин	винительный падеж
act	action noun		pahāna - nt <b>act</b>	Noun describing an active process (e.g) abandoning	действие	существительное действие
ADHa	Abhidhamma Aṭṭhakathā					
ADHt	Abhidhamma Ṭīkā					
adj	adjective	guṇavacana	pāpaka; kalyāṇa; anicca	A word that expresses an attribute of something; usually qualify a noun (e.g. bad, good, impermanent)	прил	прилагательное
ADT	Abhidhammamātikāpāḷi					Абхидхаммама̄тика̄па̄л̣и
adv	adverb	kriyāvisesana	idha - ind <b>adv</b>	The word class that qualifies verbs or clauses (e.g. here)	нар	наречие
agent	agent noun	kattar; kattukāraka; kattuvācakapada	bhāsitar; cora; sāvaka	A person who does the action of the verbal root (e.g. speaker; thief; hearer)	деятель	существительное деятель, кто совершает действие
AN	Aṅguttara Nikāya			Book 4 of the Sutta Piṭaka; Numbered Discourses; lit. one part more collection		Ангуттара Никая
ANa	Aṅguttara Nikāya Aṭṭhakathā	Manorathapūraṇī		Commentary on the Aṅguttara Nikāya compiled by Ven. Buddhaghosa; the “Fulfiller of Wishes”; lit. which fills with mental delight		Ангуттара Никая Комментарий
ANt	Aṅguttara Nikāya Tīkā	Sāratthamañjūsā				
aor	aorist verb	ajjatanī; atītakāla	ahosi; nisīdi; udapādi	A form of a verb that, in the indicative mood, expresses past action. (e.g. was; sat down; arose)	аор	аорист, прошедшее время
APA	Therāpadāna			Book 10 of the Khuddaka Nikāya; Legends of the Elder Monks		Тхерападана
APAa	Therāpadāna Aṭṭhakathā					
API	Therīapadāna			Book 11 of the Khuddaka Nikāya; Legends of the Elder Nuns		Тхериападана
APIa	Therīapadāna Aṭṭhakathā					
APP	Abhidhānappadīpikāpāṭha					Абхидха̄наппадӣпика̄па̄т̣ха
app	active past participle		bhuttāvī; dassāvī	e.g. who has eaten; who has seen	прич.прош.действ	причастие прошедшего времени действительного залога
APt	Abhidhānappadīpikā Ṭīkā			A fourteenth century Pāḷi thesaurus.		Абхидха̄наппадӣпика̄т̣ӣка̄
base	pronominal base	liṅga	ta; ima; ya; kaci	e.g. that, this, which, someone	основа	основа местоимения
BD	Concise Pali English Dictionary (by Ven. Buddhadatta)			"<a class=""link"" href=""http://www.ahandfulofleaves.org/documents/concise%20pali%20english%20dictionary_buddhadatta.pdf"">web-link</a>"		Краткий Словарь Пали-Англ. Досл. Буддхадатта
BDN	Buddhist Dictionary by Ven. Ñāṇatiloka Mahathera			"<a class=""link"" href=""https://www.palikanon.com/english/wtb/dic_idx.html"">web-link</a>"		Буддийский Cловарь дост. Ньа̄н̣атилока Махатхера
BMC	Buddhist Monastic Code (by Ajahn Ṭhānissaro)			"<a class=""link"" href=""https://www.dhammatalks.org/vinaya/bmc/Section0000.html"">web-link</a>"		Буддийский монашеский кодекс
BSK	Edgerton's Buddhist Hybrid Sanskrit Dictionary			"<a class=""link"" href=""https://www.sanskrit-lexicon.uni-koeln.de/scans/BHSScan/2020/web/index.php"">web-link</a>"		Буддийский Санскрит, Смешанный Словарь Буддийского Санскрита Эджертона
BV	Buddhavaṃsa			Book 12 of the Khuddaka Nikāya; “The Chronicle of the Buddhas”		Буддхаванса
BVa	Buddhavaṃsa Aṭṭhakathā	Madhuratthavilāsinī				
card	cardinal number	saṅkhyāpadhāna	cattāro; pañca; eka	The number of elements in a mathematical set; denotes a quantity but not the order (e.g. four, five; one)	колч	количественное числительное
caus	causative verb	kārita; hetvatthakriyā	bhāveti; samādapeti; paññapeti	Causative verbs indicate that one person causes another person to do something. (e.g. causes to become; encourages; causes to know)	понудит	каузатив, побудительный, понудительный залог
CDB	The Connected Discourses of the Buddha: A New Translation of the Samyutta Nikaya by Bhikkhu Bodhi					Связанные беседы Будды: новый перевод Самьютта-Никаи Бхиккху Бодхи
CMA	Comprehensive Manual of Abhidhamma by Bhikkhu Bodhi			"<a class=""link"" href=""https://www.saraniya.com/books/meditation/Bhikkhu_Bodhi-Comprehensive_Manual_of_Abhidhamma.pdf"">read online</a>"		Всеобъемлющее руководство по Абхидхамме Бхиккху Бодхи
CND	Cūḷaniddesa			Book 17 of the Khuddaka Nikāya; canonical commentary on the Pārāyanavagga of the Sutta Nipāta; lit. smaller detailed analysis		Чӯл̣аниддеса
comm	commentary meaning			English summary from the commentary definition	комм	перевод комментария
comp	compound	samāsa	yathābhūta; gahapati; sikkhāpada	When two or more words are combined to form a single unit	сост	"сложное слово ""самаса""; составное"
comp vb	compound verb		etadavoca; manasikaroti; pāturahosi	When verb is combined with another word(s) to form a single unit	сост.гл	составной глагол
compar	comparative adjective		anuttara; purima; paṇītatara	The comparative form of an adjective (e.g. higher, earlier, more sublime)	сравн	сравнительная форма
comps	in compounds. word is only found as an element within compounds words					
cond	conditional mood	kālātipatti; sattamī	abhavissa; agamissa	Imposing or depending on or containing a condition (e.g. if would be; if could have been; would have gone)	усл	условное наклонение
Cone	Pali Dictionary by Margaret Cone					Палийский Cловарь Маргарет Коун
CP	Cariyā Piṭaka			Book 13 of the Khuddaka Nikāya; the Basket of Conduct		Чарийа Питака
CPa	Cariyāpiṭaka Aṭṭhakathā, Paramatthadīpanī					
CPD	Critical Pāli Dictionary			"<a class=""link"" href=""https://cpd.uni-koeln.de"">web-link</a>"		Критический Словарь Пали
cs	conjugational sign				пс	признак сопряжения
CST	Chaṭṭha Saṅgāyana Tipiṭaka, Sixth Council Version of the texts encoded by the Vipassana Research Institute					
dat	dative case	catutthī, sampadānavacana	hitāya - noun, nt <b>dat</b> sg of hita	showing the object or person to or for whom something is given or done. (to; for)<br/>(e.g. for the benefit)	дат	дательный падеж
deno	denominative verb				отымённ	отымённое слово
derog	derogatory				умал	умаляющая форма
desid	desiderative verb	tumicchattha			дезид	дезидеративная форма
DHK	Dhātukathāpāḷi					Дхаммапада
DHP	Dhammapada			Book 2 of the Khuddaka Nikāya; Dhamma Verses		Дхаммапада Комментарий
DHPa	Dhammapada Aṭṭhakathā,			Commentary to Dhammapada compiled by Ven. Buddhaghosa; part of  “Illumination of the Ultimate Truth”		
DHS	Dhammasaṅgaṇīpāḷi					
DHSt	Dhammasaṅgaṇī Ṭīkā					
dial	dialect, non Indo-Aryan word		dhāropa; māḷa	Vocabulary that is characteristic of a specific group of people or specific place	диал	диалект
dimin	diminutive noun		dāraka; phusitaka; kuṭikā	A word that is formed with a suffix (such as -let or -ing) to indicate smallness (e.g. booklet, droplet)	уменьш	уменьшительное существительное
ditrans	ditransitive verb	dvikammaka	pucchati; yācati	A verb (or verb construction) that takes two objects in the accusative case. (e.g. asks someone for something)	двперех	двойной переходный, транзитивный глагол
DN	Dīgha Nikāya			Book 1 of the Sutta Piṭaka; Collection of Long Discourses; lit. long collection		Дигха Никая
DNa	Dīgha Nikāya Aṭṭhakathā, Sumaṅgalavilāsinī			Commentary on the Dīgha Nikāya compiled by Ven. Buddhaghosa; lit. very auspicious and charming		Дигха Никая Комментарий
DNt	Dīgha Nikāya Ṭīkā, Sādhuvilāsinī					
DS	Dhammasaṅgaṇī			Book 1 of the Abhidhamma Piṭaka; enumeration of phenomena		Дхаммасан̇ган̣ӣ
DSa	Dhammasaṅgaṇī aṭṭhakathā			Commentary on the Dhammasaṅgaṇi compiled by Ven. Buddhaghosa;  “Exposition of Meaning”		Комментарий к Дхаммасан̇ган̣ӣ; Ат̣т̣хаса̄линӣ
DSṭ	Dhammasaṅgaṇī mūlaṭīkā					Дхаммасан̇ган̣ӣ мӯлат̣ӣка̄
emph	emphatic particle		eva; kho; have	Express some emphasis or stress something (e.g. only; just; indeed)	выраз	побуждающая выразительная частица
EV	Elder's Verses by K.R.Norman					Стихи старейшин К. Р. Нормана
excl	exclamation		aho; abbhutaṃ; ambho	Expressing spontaneous feelings, reactions or make the sentences stronger. Sometimes used to attract attention. (e.g. oh no! most certainly! wonderful! hey!)	воскл	восклицание
fem	feminine noun	itthī; itthiliṅga	āpatti; vedanā; bhikkhunī		жен	женский род
fut	future tense	bhavissantī; anāgatakāla	bhavissati; gamissati; assasissati	A verb tense that expresses actions or states in the future	буд	будущее время
gen	genitive case	chaṭṭhī, sāmivacana, sambandha	me - pron, 1st <b>gen</b> sg of ahaṃ	showing possession (of 's)<br/>(e.g. my, mine)	род	родительный падеж
gen abs	genitive absolute construction		me sato; tassa jānato passato	When a noun or a pronoun in the genitive case is used with a participle in the same case as itself, the construction is called genitive absolute. It can be translated as when, while, since, or as. Sometimes it also has the meaning of since, although, even if, despite, in spite of, notwithstanding.	род.абс	родительный падеж абсолютная конструкция
ger	gerund. a verb, often ending in -ing, expressing ongoing action	avyaya; bhāvapada	upasampajja; pahāya; ādāya	A verb (or verbal adjective), often ending in -ing, expressing ongoing action (eg. doing; making; going).	деепр.сов	деепричастие совершенного вида
gram	grammatical term, technical term		padasandhi		грам	грамматический термин
idiom	idiomatic expression	bhāsārītyanugata	app'eva nāma	A manner of speaking that is natural to native speakers of a language or an expression whose meanings cannot be inferred from the meanings of the words that make it up	идиом	идиома; фразеологизм
imp	imperative mood	pañcamī; idānaṃ	gaccha; atthu; hotu	Mood that expresses an intention to influence the listener's behavior or expresses wish. (e.g. begone! may there be! may it be!)	повелит	повелительное наклонение
imperf	imperfect past tense	hiyyattanī; hīyattanī	addasā; ahuvā; accagamā	Past tense which is used for events which happened before yesterday, but were seen by the speaker.	имперф	имперфектное прошедшее время
impers	impersonal	bhāva	paṭibhāti; kappati	Not relating to or responsive to individual persons (e.g. it occurs (to); it is suitable (for))	безличн	безличный глагол
in comps	in compounds. word is only found in compounds words		anupassī; paṭisaṃvedī	Usually acts as part of a compoun	в составе	в составе сложных слов
ind	indeclinable word	nipāta; avyaya	api; pana; atha	It does not have declensions or conjugations.	несклон	несклоняемое слово
inf	infinitive verb	tumanta; avyaya	kātuṃ; pahātuṃ; carituṃ	The uninflected form of the verb. It most commonly expresses a purpose.	неопр	инфинитив, неопределённая форма глагола
instr	instrumental case	tatiyā, karaṇavacana	mayā - pron 1st <b>instr</b> sg of ahaṃ	shows the object or person with or by whom something is performed. (by, with or through)<br/>(e.g. by me, with me)	твор	творительный, инструментальный падеж
intens	intensive verb		caṅkamati; jaṅgamati	Also called Frequentative Verbs, express the frequent repetition or the intensification of the action denoted by the simple root.	усил	усилительный глагол
interr	interrogative pronoun	pucchāsabhāva	kiṃ; kissa; kittaka	Has the nature of asking a question. (who? how? perhaps? how many?)	вопрос	вопросительное слово
intrans	intransitive verb	akammaka; akammagāhī	hoti; ujjhāyati; vijjati	A verb (or verb construction) that does not take an object in the accusative case. sometimes they take what appears to be an object in another case. (e.g. there is; is conducive to)	непереход	непереходный глагол
irreg	irregular conjugation or declension		kammunā - noun, nt instr sg of kamma, <b>irreg</b>	Differs from the usual, generally accepted patterns of conjugation or declension.	неправ	неправильное, нерегулярно образованное слово
ITI	Itivuttaka			Book 4 of the Khuddaka Nikāya; Quotations; lit. thus said		Итивуттака
ITIa	Itivuttaka Aṭṭhakathā, Paramatthadīpanī					
JA	Jātaka			Books 14 and 15 of the Khuddaka Nikāya; birth stories		Джатака
JAa	Jātaka Aṭṭhakathā			Commentary to Jātaka compiled by Ven. Buddhaghosa; part of  “Illumination of the Ultimate Truth”		Джатака комментарий
KMt	Khuddasikkhā Mūlasikkhā, Vinaya sub-commentary					
KP	Khuddaka Pāṭha			Books 1 of the Khuddaka Nikāya; lit. small passage		Куддака Патха
KPa	Khuddakapāṭha Aṭṭhakathā, Paramatthajotikā					
KV	Kathāvatthupāḷi					
KVa	Kaṅkhāvitaraṇīaṭṭhakathā			Commentary to the Pāṭimokkha, Vinayapiṭaka, compiled by Ven. Buddhaghosa		Канкхавитараниаттхакатха
KVt	Kaṅkhāvitaraṇī Purāṇaṭīkā and Kaṅkhāvitaraṇī Abhinavaṭīkā, Vinaya sub-commentary					Кан̇кха̄витаран̣ӣпура̄н̣ат̣ӣка̄
LDA	The Law of Dependent Arising by Kaṭukurunde Ñāṇananda					Закон взаимозависимого возникновения, Кат̣укурунде Ньа̄н̣ананда
lit	literal meaning			Limited to the explicit meaning of a word or parts from which the word has been constructed.	досл	буквальный, дословный смысл
loc	locative case	sattamī, bhummavacana, okāsa, ādhāra	amhesu - pron, 1st <b>loc</b> pl of ahaṃ	showing place (in, on, at, among)<br/>(e.g. in us; among us)	местн	местный падеж
loc abs	locative absolute construction		asante hārake; atthaṅgate sūriye	When a noun or a pronoun in the locative case is used with a participle in the same case as itself, the construction is called locative absolute. It can be translated as when, while, since, or as.	мест.абс	местный падеж абсолютная конструкция
masc	masculine noun	puma; pulliṅga	bhikkhu; dhamma; loka		муж	мужской род
matr	matronymic		sāriputta; mantāṇiputta; vedehiputta	A name derived from a maternal ancestor (e.g. son of Sāri; son of Mantāṇī; son of Vedehi)	матр	указывающий на происхождение; матроним
MIL	Milindapañha			Book 19 of the Khuddaka Nikāya; the “Questions of Milinda”		Вопросы Милинды
MLDB	Middle Length Discourses of the Buddha, translated by Bhikkhu Bodhi			Book 19 of the Khuddaka Nikāya; the “Questions of Milinda”		
MN	Majjhimā Nikāya			Book 2 of the Sutta Piṭaka; Collection of Middle-length Discourses; lit. middle collection 		Мадджхима Никая
MNa	Majjhimā Nikāya Aṭṭhakathā, Papañcasūdanī			Commentary on the Majjhima Nikāya compiled by Ven. Buddhaghosa; “Destruction of Obstacles [to Progress]”; lit. setting mental proliferation in order		Мадджхима Никая Комментарий
MNt	Majjhima Nikāya Ṭīkā					
MOGG	Moggallāna Byākaraṇaṃ					Моггалланабйакаранан
MW	Monier-Williams Sanskrit-English Dictionary			"<a class=""link"" href=""https://www.sanskrit-lexicon.uni-koeln.de/scans/MW72Scan/2020/web/index.php"">web-link</a>"		Санскр-Анг Словарь Монье Вильямс
NDB	The Numerical Discourses of the Buddha: A Complete Translation of the Anguttara Nikaya by Bhikkhu Bodhi					
neg	negative	avya sadda	na	express negation or opposite meaning	отриц	отрицательная частица
neut	neuter noun				сред	средний род
NIDD1	Mahāniddesa			Book 16 of the Khuddaka Nikāya; canonical commentary on the Aṭṭhakavagga of the Sutta Nipāta; lit. great detailed analysis		Маха̄ниддеса
NIDD1a	Mahāniddesa Aṭṭhakathā			Commentary to Mahāniddesa		
NIDD2	Cūḷaniddesa			Book 17 of the Khuddaka Nikāya; canonical commentary on the Pārāyanavagga of the Sutta Nipāta; lit. smaller detailed analysis		Чӯл̣аниддеса
NIDD2a	Cūḷaniddesa Aṭṭhakathā					
NMS	Nibbana: The Mind Stilled by Kaṭukurunde Ñāṇananda					Ниббана: Успокоенный разум, Кат̣укурунде Ньа̄н̣ананда
nom	nominative case	paṭhamā, paccattavacana	tuvaṃ - pron, 2nd <b>nom</b> sg of tvaṃ	The category of nouns serving as the grammatical subject of a verb	имен	именительный падеж
noun	noun; substantive	nāma; nāmanāma	samaṇa; purisa; paṭipadā	A content word that can be used to refer to a person, place, thing, quality, or action; the word class that can serve as the subject or object of a verb, the object of a preposition, or in apposition (e.g. recluse; man; method)	сущ	существительное
NP	Nettippakaraṇapāḷi					
NPa	Nettippakaraṇa Aṭṭhakathā					
NPt	Nettippakaraṇa Ṭīkā					
nt	neuter noun	napuṃsaka; napuṁsakaliṅga	citta, rūpa, viññāṇa		ср	средний род
onom	onomatopoeia		capucapu, sū, surusuru	Using words that imitate the sound they denote	оном	ономатопея, звукоподражание
opt	optative mood	sattamī	siyā; gaccheyya; uddiseyya	A mood that expresses a wish, probability, advice or capability; expressed in English by modal verbs (should / could / may / might)	желат	оптативное, желательное наклонение
ordin	ordinal number	saṅkhyāpūraṇa	paṭhama; dutiya; tatiya	The number designating place in an ordered sequence (e.g. first; second; third)	поряд.ч	порядковое числительное
pass	passive verb	kamma; kammakāraka	pahīyati; vuccati; paññāyati	The voice used to indicate that the grammatical subject of the verb is the recipient (not the source) of the action denoted by the verb (e.g. is abandoned; is said; is clearly known)	страд	страдательный залог
patr	patronymic		kassapa; bhāradvāja; kaccāna	A name derived from a paternal ancestor (e.g. descendant of Kassapa; descended from Bharadvāja; descendant of Kati)	патр	указывающий на происхождение, о префиксе, суффиксе, патроним
PDB	Princeton Dictionary of Buddhism					Словарь Буддизма Принстонского университета
PED	Pāli English Dictionary, published by the Pāli Text Society			"<a class=""link"" href=""https://dsal.uchicago.edu/dictionaries/pali/"">web-link</a>"		Пали Английский Словарь Общества Палийских Текстов
perf	perfect past tense	parokkhā	āha; āhaṃsu; pāva	express something that happened a long time ago, a completed action, something you personally did not witness.	перф	перфектное прошлое время
Perniola	Pali Grammar by V.Perniola			"<a class=""link"" href=""https://archive.org/details/PaliGrammarVitoPerniola"">read online</a>"	Перниола	Грамматика Пали, В. Перниола
pl	plural number	bahuvacana	tumhe - pron, 2nd nom <b>pl</b> of tvaṃ	The form of a word that is used to denote more than one	мн	множественное число
PM	Paṭisambhidā Magga			Book 18 of the Khuddaka Nikāya; Path to Analytical Knowledge		Пат̣исамбхида̄ Магга
PMa	Paṭisambhidāmagga aṭṭhakathā, Saddhammappakāsinī					
pos	part of speech	pada		One of the traditional categories of words intended to reflect their functions in a grammatical context		часть речи
pp	past participle	krudanta	vutta; nisinna; suta	Verbal adjective which describes the action that a noun did (in the past) (e.g. have said; have seated; have heard)	прич.прош.страд	причастие прошедшего времени страдательного залога
PP	Puggalapaññattipāḷi					
PPa	Puggalapaññatti aṭṭhakathā			Commentary to Puggalapaññatti		Комментарий к Пат̣исамбхида̄ Магга
pr	present tense	vattamānā; vattamānakāla	viharati; uppajjati; passati	A verb tense that expresses actions or states at the time of speaking (e.g. lives; appears; sees)	наст	настоящее время
prefix	prefix	upasagga	ā-; abhi-; nī-	An affix that is added in front of the word	прист	приставка, префикс
prep	preposition	nipāta; avyaya	saddhiṃ; purato; anto	A function word that combines with a noun or pronoun or noun phrase to form a prepositional phrase that can have an adverbial or adjectival relation to some other word (e.g. with; in front (of); within)	предл	предлог; препозиция
prk	Prakrit			Any of the vernacular indic languages of north and central india (as distinguished from sanskrit) recorded from the 3rd century BC to the 4th century AD		Пракрит
