abbrev	meaning	pāli	example	explanation	ru_abbrev	ru_meaning
pron	pronoun, pronominal adjective	sabbanāma	so; etaṃ; añña; sabba	A function word that is used in place of a noun or noun phrase (he; this; another; all)	местоим	местоимение
prp	present participle	missakiriya	passanta; viharanta; jānanta	Verbal adjective, which describes the action that a noun is doing. (seeing; dwelling; knowing)	прич.наст	причастие настоящего времени
PRS	Padarūpasiddhi					Падарупасиддхи
PTH	Paṭṭhānapāḷi					
PTP	Peṭakopadesapāḷi					
ptp	potential particle, future passive participle	kicca	karaṇīya; veditabba; sikkhitabba	Verbal adjectives, they give more information about the noun they are describing. (e.g. ought to be done; can be known; should be practised)	прич.буд	причастие будущего времени
PV	Petavatthu			Book 7 of the Khuddaka Nikāya; lit. story about ghosts		Пета Ваттху
PVa	Petavatthu Aṭṭhakathā, Paramatthadīpanī					
PYt	Pācityādiyojanāpāḷi, Vinaya sub-commentary					
reflx	reflexive verb		karomase; sikkhassu; bhāvayate	The reflexive voice contains the idea of an action coming back to the person who did the action, i.e. reflecting back to the doer. Reflexive verbs can be translated into English with a reflexive pronoun. (he himself, they themselves etc.)	возвр	возвратный глагол; средний залог
sandhi	sandhi compound		evaṃ + eva > evam'eva	It refers to the changes that take place when the different parts of the speech are joined together.	сандхи	слияние слов; сандхи
SBS-PER	SBS Pāli English Recitations			"Download the latest version <a class=""link"" href=""https://github.com/sasanarakkha/pali-English-recitations/releases/latest"">here</a>"		Сборник SBS
SCPN	Syntax of the Case in the Pali Nikayas by O.H. de A. Wijesekera			"<a class=""link"" href=""https://www.ancient-buddhist-texts.net/Textual-Studies/Syntax-of-the-Cases/Syntax-of-the-Cases.pdf"">read online</a>"		Синтакс падежей в Пали Никая, Виджесекера
SDM	Saddanītippakaraṇaṃ Dhātumālā					Садданитиппакаранан Дхатумала
SDt	Sāratthadīpanī Ṭīkā, Sub-commentary to Samantapāsādikā			Sub commentary to Samantapāsādikā		Подкомментарий к Са̄раттхадӣпанӣ
sg	singular number	ekatta; ekavacana	ajjhattaṃ - ind, adv, comp, acc <b>sg</b> of ajjhatta	The form of a word that is used to denote one in number	ед	единственное число
SN	Saṃyutta Nikāya			Book 3 of the Sutta Piṭaka; Collection of Connected Discourses; lit. connected collection 		Саньютта Никая
SNa	Saṃyutta Nikāya Aṭṭhakathā, Sāratthappakāsinī			Commentary on the Saṃyutta Nikāya compiled by Ven. Buddhaghosa; “Revealer of Essential Meaning”; lit. shining essence of the goal		Саньютта Никая Комментарий
SNP	Sutta Nipāta			Book 5 of the Khuddaka Nikāya; “Sutta Collection”; lit. Irregular Discourses		Сутта Нипата
SNPa	Sutta Nipāta Aṭṭhakathā, part of Paramatthajotikā			Commentary to Sutta Nipāta compiled by Ven. Buddhaghosa; part of  “Illumination of the Ultimate Truth”		Сутта Нипата Комментарий
SNt	Saṃyutta Nikāya Ṭīkā					
SPM	Saddanītippakaraṇaṃ Padamālā					Садданитиппакаранан Падамала
SPV	Saṃgāyanassa pucchā vissajjanā					Сам̣га̄йанасса пуччха̄ виссаджджана̄
suffix	suffix	paccaya	-ima; -tama; -dhā	an affix that is added at the end of the word	суфф	суффикс
superl	superlative adjective		pacchima; pāpiṭṭha; antima	increasing meaning of something; expresses a sense of the ‘most’ of something. (examples: lowest; highest)	превосх	превосходная степень
TH	Theragāthā			Book 8 of the Khuddaka Nikāya; Verses of the Elder Monks		Тхерагатха
THa	Theragāthā Aṭṭhakathā					
THI	Therīgāthā			Book 9 of the Khuddaka Nikāya; Verses of the Elder Nuns		Тхеригатха
THIa	Therīgāthā Aṭṭhakathā					
trans	transitive verb	sakammaka	karoti; vadati; gacchati	A verb (or verb construction) that requires an object in the accusative case. (e.g. makes something; says to; goes to)	переход	переходный, транзитивный глагол
UD	Udāna			Book 3 of the Khuddaka Nikāya; Inspired Sayings; lit. breath up; sigh		Удана
UDa	Udāna Aṭṭhakathā, Paramatthadīpanī					
VAt	Vinayālaṅkāra Ṭīkā					
VBt	Vajirabuddhi Ṭīkā, Vinaya sub-commentary					
ve	verbal ending				оконч	окончание глагола
verb	verb	kriyapada, ākhyāta	pajānāti; upasaṅkami; carati	The word class that serves as the predicate of a sentence	гл	глагол
VIBH	Vibhaṅgapāḷi			Book 2 of the Abhidhamma Piṭaka; lit. analysis		Вибхан̇га
VIBHa	Vibhaṅga aṭṭhakathā			Commentary on the Vibhaṅga, Abhidhammapiṭaka		Комментарий к Вибхан̇га
VIBHt	Vibhaṅga mūlaṭīkā			Sub commentary on the Vibhaṅga, Abhidhammapiṭaka		Подкомментарий к Вибхан̇га
VIN	Vinaya Piṭaka			The first basket of the Tipiṭaka; the Discipline; lit. leading out		Виная Питака
VINa	Vinaya Piṭaka Aṭṭhakathā, Samantapāsādikā			Ven. Buddhaghosa's commentary on the Vinaya Piṭaka; lit. making everything clear; (or) all-inspiring 		Виная Питака Комментарий
VINt	Vinaya Piṭaka Ṭīkā, Sāratthadīpanīṭīkā					
VISM	Visuddhimagga			Path of purification; commentarial treatise by Ven. Buddhaghosa		Висуддхимагга
VISMa	Visuddhimagga Aṭṭhakathā			Commentary to Visuddhimagga 		Комментарий к Висуддхимагга
VMVt	Vimativinodanī Tīkā, Vinaya sub-commentary					Вимативинодани Подкомментарий
voc	vocative case	āmantaṇavacana, ālapanavacana, sambodhana	āvuso - ind, <b>voc</b> sg and pl	Addressing form	зват	звательный падеж
VSa	Vinayasaṅgaha Aṭṭhakathā, Vinaya sub-commentary					
VV	Vimānavatthu			Book 6 of the Khuddaka Nikāya; story about Celestial Abodes		Вимана Ваттху
VVa	Vimānavatthu Aṭṭhakathā, Paramatthadīpanī					
VVt	Vinayavinicchaya Ṭīkā, Vinaya sub-commentary					
VVUt	Vinayavinicchaya Uttaravinicchayo, Vinaya sub-commentary					
wrt	with regard to					по отношению к
x	no gender		pañca - card, <b>x</b> pl	Word does not have any specific gender		не имеет рода
YAM	Yamakapāḷi					
Kacc	Kaccāyana		<b>Kacc</b> 507, 501	name of a famous grammatical treatise, and the classical school of Pāḷi grammar which ascribes to it	Качч	
