pali,class_ource,class_sutta,class_example,english_tranlsation
attha 2.1,DHP331,nāgavaggo,atthamhi sahāyā,[Good are] friends in [arisen] need (or) [Good are] friends when need [arises]
anālaya 1,SN56.11,dhammacakkappavattanasuttaṃ,cāgo paṭinissaggo anālayo,"The relinquishing, the abandonment, the non-attachment"
anuttara,SN11.3,dhajaggasuttaṃ,iti'pi so bhagavā arahaṃ sammāsambuddho vijjācaraṇasampanno sugato lokavidū <b>anuttaro</b> purisadammasārathi satthā devamanussānaṃ buddho bhagavā'ti,"It is so (thus) “He [is] the Blessed One, the Worthy One, the fully Enlightened One, endowed with wisdom and ethical conduct, Fortunate One, knower of the world, incomparable leader of persons to be tamed, teacher of gods and humans, the Awakened One, the Blessed One.”"
apara 1,,,aparena samayena buddho,"on another occasion, the Awakened One…"
aparena samayena 1,,,aparena samayena buddho,"on another occasion, the Awakened One…"
