pali,pos,meaning,source_1,sutta_1,example_1,source_2,sutta_2,example_2,source_3,sutta_3,example_3,source_4,sutta_4,example_4
akampi,aor,shook; trembled; wavered; was disturbed,AN3.126,gotamakacetiyasuttaṃ,idam'avoca bhagavā. attamanā te bhikkhū bhagavato bhāsitaṃ abhinandun'ti. imasmiñ'ca pana veyyākaraṇasmiṃ bhaññamāne sahassī lokadhātu <b>akampitthā</b>'ti.,,,,,,,,,
akuppa 1,ptp,unshakeable; unwavering; unassailable,SN56.11,dhammacakkappavattanasuttaṃ,"ñāṇañ'ca pana me dassanaṃ udapādi, <b>akuppā</b> me vimutti, ayam'antimā jāti, n'atth'idāni punabbhavo'ti.",ITI62,indriyasuttaṃ,"tato aññā vimuttassa,
ñāṇaṃ ve hoti tādino,
<b>akuppā</b> me vimuttī'ti,
bhavasaṃyojanakkhayā.",MN29,mahāsāropamasuttaṃ,"yā ca kho ayaṃ, bhikkhave, <b>akuppā</b> cetovimutti, etadattham'idaṃ, bhikkhave, brahmacariyaṃ, etaṃ sāraṃ etaṃ pariyosānan'ti.",,,
atthaveda,masc,inspiration from the meaning; (comm) inspiration from the commentary,AN6.10,mahānāmasuttaṃ,"ujugatacitto kho pana, mahānāma, ariyasāvako labhati <b>atthavedaṃ</b>, labhati dhammavedaṃ, labhati dhamm'ūpasaṃhitaṃ pāmojjaṃ.",MN7,vatthasuttaṃ,"yathodhi kho pan'assa cattaṃ hoti vantaṃ muttaṃ pahīnaṃ paṭinissaṭṭhaṃ, so buddhe aveccappasādena samannāgatomhī'ti labhati <b>atthavedaṃ</b>, labhati dhammavedaṃ, labhati dhamm'ūpasaṃhitaṃ pāmojjaṃ.",,,,,,
anāsava 1,adj,free from the effluents; taint-less; undefiled; epithet of Nibbāna,AN5.23,upakkilesasuttaṃ,"so sace ākaṅkhati, āsavānaṃ khayā <b>anāsavaṃ</b> cetovimuttiṃ paññāvimuttiṃ diṭṭh'eva dhamme sayaṃ abhiññā sacchikatvā upasampajja vihareyyan'ti, tatra tatr'eva sakkhibhabbataṃ pāpuṇāti sati sati āyatane'ti.",SNP62,"nanda māṇava pucchā
pārāyanavaggo 7","n'āhaṃ sabbe samaṇabrāhmaṇāse,
jātijarāya nivutā'ti brūmi,
ye s'īdha diṭṭhaṃ'va sutaṃ mutaṃ vā,
sīlabbataṃ vā'pi pahāya sabbaṃ,
anekarūpam'pi pahāya sabbaṃ,
taṇhaṃ pariññāya <b>anāsavāse</b>,
te ve narā oghatiṇṇā'ti brūmi.",SN36.5,daṭṭhabbasuttaṃ,"sa ve samm'addaso bhikkhu, parijānāti vedanā.
so vedanā pariññāya, diṭṭhe dhamme <b>anāsavo</b>.
kāyassa bhedā dhammaṭṭho, saṅkhyaṃ n'opeti vedagū'ti.",SN43.14-43,"asaṅkhatasaṃyuttaṃ, anāsavādisuttaṃ","taṃ suṇātha. katamañ'ca, bhikkhave, <b>anāsavaṃ</b> … saccañ'ca vo, bhikkhave, desessāmi saccagāmiñ'ca maggaṃ. taṃ suṇātha."
antaradhāyati,pr,disappears; vanishes,MN49,brahmanimantanikasuttaṃ,"handa carahi te, mārisa, passa <b>antaradhāyāmī</b>'ti. handa carahi me tvaṃ, brahme, <b>antaradhāyassu</b>, sace visahasī'ti.",SN5.5,uppalavaṇṇāsuttaṃ,"esā <b>antaradhāyāmi</b>,
kucchiṃ vā pavisāmi te,
pakhum'antarikāyam'pi,
tiṭṭhantiṃ maṃ na dakkhasi.",AN6.62,purisindriyañāṇasuttaṃ,"seyyathā'pi vā panānanda, rattiyā paccūsasamayaṃ sūriye uggacchante, jāneyyāsi tvaṃ, ānanda, andhakāro <b>antaradhāyissati</b>, āloko pātubhavissatī'ti?",,,
andhakāra 1,masc,darkness; blackness; blindness,DHP146,jarāvaggo,"ko nu hāso kim'ānando,
niccaṃ pajjalite sati,
<b>andhakārena</b> onaddhā,
padīpaṃ na gavesatha.",SNP4,"kasibhāradvājasuttaṃ
uragavaggo 4","seyyathā'pi, bho gotama, nikkujjitaṃ vā ukkujjeyya, paṭicchannaṃ vā vivareyya, mūḷhassa vā maggaṃ ācikkheyya, <b>andhakāre</b> vā telapajjotaṃ dhāreyya, cakkhumanto rūpāni dakkhintī'ti.",AN6.62,purisindriyañāṇasuttaṃ,"seyyathā'pi vā panānanda, rattiyā paccūsasamayaṃ sūriye uggacchante, jāneyyāsi tvaṃ, ānanda, <b>andhakāro</b> antaradhāyissati, āloko pātubhavissatī'ti?",SN46.55,saṅgāravasuttaṃ,"seyyathā'pi, brāhmaṇa, udapatto āvilo luḷito kalalībhūto <b>andhakāre</b> nikkhitto. tattha cakkhumā puriso sakaṃ mukhanimittaṃ paccavekkhamāno yathābhūtaṃ na jāneyya na passeyya."
apakkanta,pp,departed (from); left; strayed (from); veered away (from),AN3.65,sarabhasuttaṃ,aññāya ca pan'āhaṃ samaṇānaṃ sakyaputtikānaṃ dhammaṃ ev'āhaṃ tasmā dhammavinayā <b>apakkanto</b>'ti.,MN70,kīṭāgirisuttaṃ,"kīva dūr'ev'ime, bhikkhave, moghapurisā <b>apakkantā</b> imamhā dhammavinayā.",,,,,,
appaccaya 1.2,masc,indignation; outrage; bitterness,MN5,anaṅgaṇasuttaṃ,"ṭhānaṃ kho pan'etaṃ, āvuso, vijjati yaṃ taṃ bhikkhuṃ bhikkhū jāneyyuṃ, āpattiṃ āpanno'ti. jānanti maṃ bhikkhū āpattiṃ āpanno'ti, iti so kupito hoti appatīto. yo c'eva kho, āvuso, kopo yo ca <b>appaccayo</b>, ubhayam'etaṃ aṅgaṇaṃ.",AN3.68,kathāvatthusuttaṃ,"sac'āyaṃ, bhikkhave, puggalo pañhaṃ puṭṭho samāno aññen'aññaṃ paṭicarati, bahiddhā kathaṃ apanāmeti, kopañ'ca dosañ'ca <b>appaccayañ</b>'ca pātukaroti, evaṃ sant'āyaṃ, bhikkhave, puggalo akaccho hoti.",,,,,,
appiccha,adj,with few wishes; wanting little; having few needs; modest,DHP404,brāhmaṇavaggo,"asaṃsaṭṭhaṃ gahaṭṭhehi,
anāgārehi c'ūbhayaṃ,
anokasārim'<b>app'icchaṃ</b>,
tam'ahaṃ brūmi brāhmaṇaṃ.",AN8.23,paṭhamahatthakasuttaṃ,"<b>app'iccho</b> so, bhikkhu, kulaputto. sante'y'eva attani kusaladhamme na icchati parehi ñāyamāne.",VIN1.1.2,dutiyapārājikaṃ,"ye te bhikkhū <b>app'icchā</b> santuṭṭhā lajjino kukkuccakā sikkhākāmā te ujjhāyanti khiyyanti vipācenti, kathañ'hi nāma āyasmā dhaniyo kumbhakāraputto rañño dārūni adinnaṃ ādiyissatī'ti!",AN8.30,anuruddha mahāvitakkasuttaṃ,"idha, bhikkhave, bhikkhu <b>app'iccho</b> samāno <b>app'iccho</b>'ti maṃ jāneyyun'ti na icchati, santuṭṭho samāno santuṭṭho'ti maṃ jāneyyun'ti na icchati"
abhisajjati 2.1,pr,loses one's temper; curses angrily; abuses; swears; (comm) sticks,AN3.27,jigucchitabbasuttaṃ,"idha, bhikkhave, ekacco puggalo kodhano hoti upāyāsabahulo, appam'pi vutto samāno <b>abhisajjati</b> kuppati byāpajjati patitthīyati, kopañ'ca dosañ'ca appaccayañ'ca pātukaroti.",,,,,,,,,
abhisanda,masc,outcome; outflow; stream,SN55.31,paṭhamapuññābhisandasuttaṃ,ayaṃ paṭhamo puñña-<b>abhisando</b> kusala-<b>abhisando</b> sukhass'āhāro.,VINa1,ganthārambhakathā,"icc'evam accantanamassanīyaṃ,
namassamāno ratanattayaṃ yaṃ,
puñña-<b>abhisandaṃ</b> vipulaṃ alatthaṃ,
tass'ānubhāvena hat'antarāyo.",,,,,,
amata 1.1,nt,deathless state; immortality; epithet of Nibbāna,Trad,,puññāni pakatāni me sukhañ'ca tividhaṃ dentu. khippaṃ pāpetha vo-<b>amataṃ</b>.,SN1.42,kiṃdadasuttaṃ,"so ca sabbadado hoti,
yo dadāti upassayaṃ,
<b>amataṃ</b> dado ca so hoti,
yo dhammam'anusāsatī'ti.",MN106,āneñjasappāyasuttaṃ,etaṃ <b>amataṃ</b> yadidaṃ anupādā cittassa vimokkho.,DHP21,appamādavaggo,"appamādo <b>amata</b>padaṃ, pamādo maccuno padaṃ.
appamattā na mīyanti, ye pamattā yathā matā."
amatogadha,adj,flowing into the deathless; immersed in the deathless; (comm) ending in Nibbāna,AN10.58,mūlakasuttaṃ,"sat'ādhipateyyā sabbe dhammā, paññ'uttarā sabbe dhammā, vimuttisārā sabbe dhammā, <b>amat'ogadhā</b> sabbe dhammā, nibbānapariyosānā sabbe dhammā'ti.",DHP411,brāhmaṇavaggo,"yass'ālayā na vijjanti,
aññāya akathaṃkathī,
<b>amat'ogadham</b>'anuppattaṃ,
tam'ahaṃ brūmi brāhmaṇaṃ.",,,,,,
aruṇa 1,masc,red light; reddish colour in the sky; rosy fingered dawn,SN56.37,paṭhamasūriyasuttaṃ,"sūriyassa, bhikkhave, udayato etaṃ pubbaṅ'gamaṃ etaṃ pubbanimittaṃ, yadidaṃ, <b>aruṇ</b>'uggaṃ. evam'eva kho, bhikkhave, bhikkhuno catunnaṃ ariyasaccānaṃ yathābhūtaṃ abhisamayāya etaṃ pubbaṅ'gamaṃ etaṃ pubbanimittaṃ, yadidaṃ, sammādiṭṭhi.",UD45,uposathasuttaṃ,"tatiyam'pi kho āyasmā ānando abhikkantāya rattiyā, nikkhante pacchime yāme, uddhaste <b>aruṇe</b>, nandimukhiyā rattiyā uṭṭhāy'āsanā ek'aṃsaṃ uttar'āsaṅgaṃ karitvā yena bhagavā ten'añjaliṃ paṇāmetvā bhagavantaṃ etadavoca",,,,,,
avicāra,adj,free from discursive thought,SN45.8,vibhaṅgasuttaṃ,vitakkavicārānaṃ vūpasamā ajjhattaṃ sampasādanaṃ cetaso ekodibhāvaṃ avitakkaṃ <b>avicāraṃ</b> samādhijaṃ pītisukhaṃ dutiyaṃ jhānaṃ upasampajja viharissasi,SN47.10,bhikkhunupassayasuttaṃ,avitakkomhi <b>avicāro</b> ajjhattaṃ satimā sukham'asmī'ti pajānāti,,,,,,
avitakka,adj,free from thinking; without thought,SN45.8,vibhaṅgasuttaṃ,vitakkavicārānaṃ vūpasamā ajjhattaṃ sampasādanaṃ cetaso ekodibhāvaṃ <b>avitakkaṃ</b> avicāraṃ samādhijaṃ pītisukhaṃ dutiyaṃ jhānaṃ upasampajja viharissasi,SN47.10,bhikkhunupassayasuttaṃ,<b>avitakko</b>'mhi avicāro ajjhattaṃ satimā sukham'asmī'ti pajānāti,,,,,,
avivāda,masc,not quarrelling; non-dispute; no argument; harmony; peace,MN48,kosambiyasuttaṃ,"cha'y'ime, bhikkhave, dhammā sāraṇīyā piyakaraṇā garukaraṇā saṅgahāya <b>avivādāya</b> sāmaggiyā ekībhāvāya saṃvattanti.",SNP51,"mahābyūhasuttaṃ
aṭṭhakavaggo 13","appañ'hi etaṃ na alaṃ samāya,
duve vivādassa phalāni brūmi,
etam'pi disvā na vivādayetha,
khem'ābhipassaṃ <b>avivāda</b>bhūmiṃ.",,,,,,
aṃsa 2.1,masc,shoulder; shoulder-blade,MN91,brahmāyusuttaṃ,"cit'antara-<b>aṃso</b> kho pana so bhavaṃ gotamo, idam'pi tassa bhoto gotamassa mahāpurisassa mahāpurisalakkhaṇaṃ bhavati.",UD45,uposathasuttaṃ,"tatiyam'pi kho āyasmā ānando abhikkantāya rattiyā, nikkhante pacchime yāme, uddhaste aruṇe, nandimukhiyā rattiyā uṭṭhāy'āsanā eka-<b>aṃsaṃ</b> uttar'āsaṅgaṃ karitvā yena bhagavā ten'añjaliṃ paṇāmetvā bhagavantaṃ etadavoca",AN4.190,uposathasuttaṃ,"yathārūpaṃ parisaṃ alaṃ yojanagaṇanāni'pi dassanāya gantuṃ api puṭa-<b>aṃsenā</b>'pi, tathārūpo ayaṃ, bhikkhave, bhikkhusaṅgho.",,,
ādāya 1,ger,taking,AN5.162,dutiyaāghātapaṭivinayasuttaṃ,"seyyathā'pi, āvuso, bhikkhu paṃsukūliko rathiyāya nantakaṃ disvā vāmena pādena niggaṇhitvā dakkhiṇena pādena pattharitvā, yo tattha sāro taṃ paripātetvā <b>ādāya</b> pakkameyya.",DHP268,dhammaṭṭhavaggo,"na monena munī hoti,
mūḷharūpo aviddasu,
yo ca tulaṃva paggayha,
varam'<b>ādāya</b> paṇḍito.",DN2.19,sāmaññaphalasuttaṃ,"seyyathā'pi, mahārāja, puriso iṇaṃ <b>ādāya</b> kamm'ante payojeyya. tassa te kamm'antā samijjheyyuṃ.",SN22.95,pheṇapiṇḍūpamasuttaṃ,"seyyathā'pi, bhikkhave, puriso sār'atthiko sāragavesī sārapariyesanaṃ caramāno tiṇhaṃ kuṭhāriṃ <b>ādāya</b> vanaṃ paviseyya."
ādhipateyya,nt,authority; influence; power; determining factor,AN3.40,ādhipateyyasuttaṃ,"tīṇ'imāni, bhikkhave, <b>ādhipateyyāni</b>. katamāni tīṇi? att'<b>ādhipateyyaṃ</b>, lok'<b>ādhipateyyaṃ</b>, dhamm'<b>ādhipateyyaṃ</b>.",AN10.58,mūlakasuttaṃ,"sati-<b>ādhipateyyā</b> sabbe dhammā, paññ'uttarā sabbe dhammā, vimuttisārā sabbe dhammā, amat'ogadhā sabbe dhammā, nibbānapariyosānā sabbe dhammā'ti.",,,,,,
ārabhituṃ 1,inf,(of energy) to arouse,SN12.22,dutiyadasabalasutta,alam'eva saddhāpabbajitena kulaputtena vīriyaṃ <b>ārabhituṃ</b>,,,,,,,,,
āsaṅga,masc,robe; cloak,UD45,uposathasuttaṃ,"atha kho āyasmā ānando abhikkantāya rattiyā, nikkhante paṭhame yāme, uṭṭhāy'āsanā ek'aṃsaṃ uttara-<b>āsaṅgaṃ</b> karitvā yena bhagavā ten'añjaliṃ paṇāmetvā bhagavantaṃ etadavoca",VIN1.2.6,kuṭikārasikkhāpadaṃ,tena kuṭikārakena bhikkhunā kuṭivatthuṃ sodhetvā saṅghaṃ upasaṅkamitvā ek'aṃsaṃ uttar'<b>āsaṅgaṃ</b> karitvā vuḍḍhānaṃ bhikkhūnaṃ pāde vanditvā ukkuṭikaṃ nisīditvā añjaliṃ paggahetvā evam'assa vacanīyo,,,,,,
iṇa,nt,debt; loan,MN39,mahāassapurasuttaṃ,"bhikkhu yathā <b>iṇaṃ</b> yathā rogaṃ yathā bandhan'āgāraṃ yathā dāsabyaṃ yathā kantār'addhānamaggaṃ, ime pañca nīvaraṇe appahīne attani samanupassati",DN2.19,sāmaññaphalasuttaṃ,"seyyathā'pi, mahārāja, puriso <b>iṇaṃ</b> ādāya kamm'ante payojeyya. tassa te kamm'antā samijjheyyuṃ.",SNP7,"vasalasuttaṃ
uragavaggo 7","yo have <b>iṇam</b>'ādāya,
cujjamāno palāyati,
na hi te iṇamatthī'ti,
taṃ jaññā vasalo iti.",AN6.45,iṇasuttaṃ,"yam'pi, bhikkhave, daliddo assako anāḷhiko <b>iṇaṃ</b> ādiyitvā vaḍḍhiṃ paṭissuṇāti, vaḍḍhi'pi, bhikkhave, dukkhā lokasmiṃ kāmabhogino'ti?"
uggacchanta,prp,(of the sun) rising; ascending; coming up,AN6.62,purisindriyañāṇasuttaṃ,"seyyathā'pi vā panānanda, rattiyā paccūsasamayaṃ sūriye <b>uggacchante</b>, jāneyyāsi tvaṃ, ānanda, andhakāro antaradhāyissati, āloko pātubhavissatī'ti?",SN48.42,uṇṇābhabrāhmaṇasuttaṃ,"seyyathā'pi, bhikkhave, kūṭ'āgāre vā kūṭ'āgārasālāyaṃ vā pācīnavātapānā sūriye <b>uggacchante</b> vātapānena rasmi pavisitvā kv'āssa patiṭṭhitā'ti? pacchimāyaṃ, bhante, bhittiyan'ti.",,,,,,
ujjhāyati,pr,finds fault; looks down upon; thinks badly of,VIN2.7.1,parimaṇḍalavaggo,"manussā <b>ujjhāyanti</b> khiyyanti vipācenti, kathañ'hi nāma samaṇā sakyaputtiyā purato'pi pacchato'pi olambentā nivāsessanti, seyyathā'pi gihī kāmabhogino'ti.",VIN1.1.2,dutiyapārājikaṃ,"ye te bhikkhū app'icchā santuṭṭhā lajjino kukkuccakā sikkhākāmā te <b>ujjhāyanti</b> khiyyanti vipācenti, kathañ'hi nāma āyasmā dhaniyo kumbhakāraputto rañño dārūni adinnaṃ ādiyissatī'ti!",,,,,,
uttara 2.01,adj,higher (than); superior (to),Thai,,"dhammo padīpo viya tassa satthuno, yo maggapāk'āmatabhedabhinnako, lok'<b>uttaro</b> yo ca tadattha'dīpano",SN22.82,puṇṇamasuttaṃ,atha kho aññataro bhikkhu uṭṭhāy'āsanā ek'aṃsaṃ <b>uttar</b>'āsaṅgaṃ karitvā yena bhagavā ten'añjaliṃ paṇāmetvā bhagavantaṃ etad'avocas,DN22.8,mahāsatipaṭṭhānasuttaṃ,"sa<b>uttaraṃ</b> vā cittaṃ, sa<b>uttaraṃ</b> cittan'ti pajānāti, an<b>uttaraṃ</b> vā cittaṃ, an<b>uttaraṃ</b> cittan'ti pajānāti",,,
uddhasta 1,pp,risen; appeared,UD45,uposathasuttaṃ,"tatiyam'pi kho āyasmā ānando abhikkantāya rattiyā, nikkhante pacchime yāme, <b>uddhaste</b> aruṇe, nandimukhiyā rattiyā uṭṭhāy'āsanā ek'aṃsaṃ uttar'āsaṅgaṃ karitvā yena bhagavā ten'añjaliṃ paṇāmetvā bhagavantaṃ etadavoca",,,,,,,,,
uddhaste aruṇe nandimukhiyā rattiyā,idiom,when the rosy smile of dawn was rising; when dawn had risen and the night had a cheerful face,UD45,uposathasuttaṃ,"tatiyam'pi kho āyasmā ānando abhikkantāya rattiyā, nikkhante pacchime yāme, <b>uddhaste aruṇe, nandimukhiyā rattiyā</b> uṭṭhāy'āsanā ek'aṃsaṃ uttar'āsaṅgaṃ karitvā yena bhagavā ten'añjaliṃ paṇāmetvā bhagavantaṃ etadavoca",,,,,,,,,
upasaṃhita 1,pp,connected (with); concerning; to do (with); based (on),AN6.10,mahānāmasuttaṃ,"ujugatacitto kho pana, mahānāma, ariyasāvako labhati atthavedaṃ, labhati dhammavedaṃ, labhati dhamma-<b>upasaṃhitaṃ</b> pāmojjaṃ.",MN20,vitakkasaṇṭhānasuttaṃ,tesaṃ vitakkānaṃ vitakkasaṅkhārasaṇṭhānaṃ manasikaroto ye pāpakā akusalā vitakkā chand'<b>ūpasaṃhitā</b>'pi dos'<b>ūpasaṃhitā</b>'pi moh'<b>ūpasaṃhitā</b>'pi te pahīyanti,MN139,araṇavibhaṅgasuttaṃ,"cakkhuviññeyyā rūpā iṭṭhā kantā manāpā piyarūpā kām'<b>ūpasaṃhitā</b> rajanīyā, sotaviññeyyā saddā",,,
ekībhāva 1,masc,unity; harmony; becoming one,MN48,kosambiyasuttaṃ,"cha'y'ime, bhikkhave, dhammā sāraṇīyā piyakaraṇā garukaraṇā saṅgahāya avivādāya sāmaggiyā <b>ekībhāvāya</b> saṃvattanti.",AN8.2,paññāsuttaṃ,addhā ayam'āyasmā jānaṃ jānāti passaṃ passatī'ti. ayam'pi dhammo piyattāya garuttāya bhāvanāya sāmaññāya <b>ekībhāvāya</b> saṃvattati.,,,,,,
ekodibhāva,masc,singleness; integration; unification,SN45.8,vibhaṅgasuttaṃ,vitakkavicārānaṃ vūpasamā ajjhattaṃ sampasādanaṃ cetaso <b>ekodibhāvaṃ</b> avitakkaṃ avicāraṃ samādhijaṃ pītisukhaṃ dutiyaṃ jhānaṃ upasampajja viharissasi,AN3.102,paṃsudhovakasuttaṃ,tasmiṃ pahīne tasmiṃ byantīkate ath'āparaṃ dhammavitakk'āvasissati. so hoti samādhi na c'eva santo na ca paṇīto nappaṭippassaddhaladdho na <b>ekodibhāva</b>-adhigato sasaṅkhāraniggayhavāritagato hoti.,,,,,,
etadattha 1,masc,this is the purpose (of),MN30,cūḷasāropamasuttaṃ,akuppā cetovimutti <b>etadattham</b>'idaṃ brāhmaṇa brahmacariyaṃ,AN3.68,kathāvatthusuttaṃ,"<b>etadatthā</b>, bhikkhave, kathā, <b>etadatthā</b> mantanā, <b>etadatthā</b> upanisā, <b>etadatthaṃ</b> sot'āvadhānaṃ, yadidaṃ anupādā cittassa vimokkho'ti.",,,,,,
ogadha 1,pp,immersed (in); absorbed (in); plunged (into),AN10.58,mūlakasuttaṃ,"vedanāsamosaraṇā sabbe dhammā, samādhippamukhā sabbe dhammā, sat'ādhipateyyā sabbe dhammā, paññ'uttarā sabbe dhammā, vimuttisārā sabbe dhammā, amat'<b>ogadhā</b> sabbe dhammā, nibbānapariyosānā sabbe dhammā'ti.",SN48.42,uṇṇābhabrāhmaṇasuttaṃ,"accayāsi, brāhmaṇa, pañhaṃ, n'āsakkhi pañhassa pariyantaṃ gahetuṃ. nibbān'<b>ogadhañ</b>'hi, brāhmaṇa, brahmacariyaṃ vussati nibbānaparāyaṇaṃ nibbānapariyosānan'ti.",,,,,,
kacchamāna,prp,being spoken; being talked about,AN5.157,dukkathāsuttaṃ,"dussīlo, bhikkhave, sīlakathāya <b>kacchamānāya</b> abhisajjati kuppati byāpajjati patitthīyati kopañ'ca dosañ'ca appaccayañ'ca pātukaroti.",MN105,sunakkhattasuttaṃ,"āneñjapaṭisaṃyuttāya ca pana kathāya <b>kacchamānāya</b> na sussūsati, na sotaṃ odahati, na aññā cittaṃ upaṭṭhāpeti, na ca taṃ purisaṃ bhajati, na ca tena vittiṃ āpajjati.",,,,,,
kammanta 1,masc,work; business activity,SNP16,"maṅgalasuttaṃ
cūḷavaggo 4","mātāpitu upaṭṭhānaṃ, puttadārassa saṅgaho.
anākulā ca <b>kamm'antā</b>, etam'maṅgalam'uttamaṃ.",MN35,cūḷasaccakasuttaṃ,"seyyathā'pi vā pana, bho gotama, ye kec'ime balakaraṇīyā <b>kamm'antā</b> karīyanti, sabbe te pathaviṃ nissāya pathaviyaṃ patiṭṭhāya. evam'ete balakaraṇīyā <b>kamm'antā</b> karīyanti.",MN39,mahāassapurasuttaṃ,seyyathā'pi bhikkhave puriso iṇaṃ ādāya <b>kamm'ante</b> payojeyya,,,
kīva,ind,how far?; how much?,AN7.23,paṭhamasattakasuttaṃ,"yāva<b>kīvañ</b>'ca bhikkhave bhikkhū abhiṇhaṃ sannipātā bhavissanti sannipātabahulā, vuddhi'y'eva bhikkhave bhikkhūnaṃ pāṭikaṅkhā no parihāni",MN70,kīṭāgirisuttaṃ,"<b>kīva</b> dūr'ev'ime, bhikkhave, moghapurisā apakkantā imamhā dhammavinayā.",,,,,,
kukkuccaka,adj,principled; conscientious; scrupulous,VIN1.1.2,dutiyapārājikaṃ,"ye te bhikkhū app'icchā santuṭṭhā lajjino <b>kukkuccakā</b> sikkhākāmā te ujjhāyanti khiyyanti vipācenti, kathañ'hi nāma āyasmā dhaniyo kumbhakāraputto rañño dārūni adinnaṃ ādiyissatī'ti!",,,,,,,,,
kusalābhisanda,masc,outflow of good; wholesome result; stream of merit,SN55.31,paṭhamapuññābhisandasuttaṃ,ayaṃ paṭhamo puññ'ābhisando <b>kusal'ābhisando</b> sukhass'āhāro.,,,,,,,,,
kopa 1,masc,anger; wrath; rage; temper,AN3.27,jigucchitabbasuttaṃ,"idha, bhikkhave, ekacco puggalo kodhano hoti upāyāsabahulo, appam'pi vutto samāno abhisajjati kuppati byāpajjati patitthīyati, <b>kopañ</b>'ca dosañ'ca appaccayañ'ca pātukaroti.",MN21,kakacūpamasuttaṃ,"kiṃ nu kho me ayyā santaṃ'y'eva nu kho ajjhattaṃ <b>kopaṃ</b> na pātukaroti udāhu asantaṃ udāhu mayham'ev'ete kammantā susaṃvihitā yena me ayyā santaṃ'y'eva ajjhattaṃ <b>kopaṃ</b> na pātukaroti, no asantaṃ?",VIN1.2.8,duṭṭhadosasikkhāpadaṃ,appatīto'ti tena ca <b>kopena</b> tena ca dosena tāya ca anattamanatāya tāya ca anabhiraddhiyā appatīto hoti.,,,
khiyyati,pr,criticises; complains (about),VIN2.5.8.9,kammapaṭibāhanasikkhāpadaṃ,"apalokanakammaṃ ñattikammaṃ ñattidutiyakammaṃ ñatticatutthakammaṃ dhammena vinayena satthusāsanena kataṃ, etaṃ dhammikaṃ nāma kammaṃ. chandaṃ datvā <b>khiyyati</b> āpatti pācittiyassa.",VIN1.1.2,dutiyapārājikaṃ,"ye te bhikkhū app'icchā santuṭṭhā lajjino kukkuccakā sikkhākāmā te ujjhāyanti <b>khiyyanti</b> vipācenti, kathañ'hi nāma āyasmā dhaniyo kumbhakāraputto rañño dārūni adinnaṃ ādiyissatī'ti!",,,,,,
gambhīra 3,adj,profound; abstruse; hard to fathom,SNP13,"ratanasuttaṃ
cūḷavaggo 1","ye ariyasaccāni vibhāvayanti, <b>gambhīra</b>paññena sudesitāni.
kiñ'cā'pi te honti bhusappamattā, na te bhavaṃ aṭṭhamam'ādiyanti.",DHP403,brāhmaṇavaggo,"<b>gambhīra</b>paññaṃ medhāviṃ,
magg'āmaggassa kovidaṃ,
uttam'attham'anuppattaṃ,
tam'ahaṃ brūmi brāhmaṇaṃ.",SN20.7,āṇisuttaṃ,"ye te suttantā tathāgatabhāsitā <b>gambhīrā</b> <b>gambhīr</b>'atthā lok'uttarā suññatappaṭisaṃyuttā, tesu bhaññamānesu na sussūsissanti na sotaṃ odahissanti",TH4,puṇṇattheragāthā,"sabbhi'r'eva samāsetha, paṇḍiteh'atthadassibhi,
atthaṃ mahantaṃ <b>gambhīraṃ</b>, duddasaṃ nipuṇaṃ aṇuṃ,
dhīrā samadhigacchanti, appamattā vicakkhaṇā'ti."
gambhīrattha,adj,with deep meaning; profound in implication; whose meaning is profound,SN20.7,āṇisuttaṃ,"ye te suttantā tathāgatabhāsitā gambhīrā <b>gambhīr'atthā</b> lok'uttarā suññatappaṭisaṃyuttā, tesu bhaññamānesu na sussūsissanti na sotaṃ odahissanti",,,,,,,,,
garukaraṇa,adj,which creates respect; which makes one revered,MN48,kosambiyasuttaṃ,"cha'y'ime, bhikkhave, dhammā sāraṇīyā piyakaraṇā <b>garukaraṇā</b> saṅgahāya avivādāya sāmaggiyā ekībhāvāya saṃvattanti.",,,,,,,,,
cetas,masc,mind; thought; intention,VIBH6.1,paṭiccasamuppādavibhaṅgo,"tattha katamaṃ domanassaṃ? yaṃ cetasikaṃ asātaṃ, cetasikaṃ dukkhaṃ, <b>ceto</b>samphassajaṃ asātaṃ dukkhaṃ vedayitaṃ, <b>ceto</b>samphassajā asātā dukkhā vedanā.",SN35.247,chappāṇakopamasuttaṃ,"anupaṭṭhitakāyassati ca viharati parittacetaso, tañ'ca <b>ceto</b>vimuttiṃ paññāvimuttiṃ yathābhūtaṃ nappajānāti yatth'assa te uppannā pāpakā akusalā dhammā aparisesā nirujjhanti.",MN30,cūḷasāropamasuttaṃ,akuppā <b>ceto</b>vimutti etadattham'idaṃ brāhmaṇa brahmacariyaṃ,,,
chayime,sandhi,these six,MN48,kosambiyasuttaṃ,"<b>cha'y'ime</b>, bhikkhave, dhammā sāraṇīyā piyakaraṇā garukaraṇā saṅgahāya avivādāya sāmaggiyā ekībhāvāya saṃvattanti.",SN22.57,sattaṭṭhānasuttaṃ,"katamā ca, bhikkhave, saññā? <b>cha'y'ime</b>, bhikkhave, saññākāyā, rūpasaññā, saddasaññā, gandhasaññā, rasasaññā, phoṭṭhabbasaññā, dhammasaññā. ayaṃ vuccati, bhikkhave, saññā.",SN12.2,vibhaṅgasuttaṃ,"katamā ca, bhikkhave, taṇhā? <b>cha'y'ime</b>, bhikkhave, taṇhākāyā, rūpataṇhā, saddataṇhā, gandhataṇhā, rasataṇhā, phoṭṭhabbataṇhā, dhammataṇhā. ayaṃ vuccati, bhikkhave, taṇhā.",,,
tathāgatappavedita,adj,preached by the Realised One; proclaimed by the Such Become,SN56.48,dutiyachiggaḷayugasuttaṃ,"evaṃ adhiccam'idaṃ, bhikkhave, yaṃ manussattaṃ labhati. evaṃ adhiccam'idaṃ, bhikkhave, yaṃ tathāgato loke uppajjati arahaṃ sammāsambuddho. evaṃ adhiccam'idaṃ, bhikkhave, yaṃ <b>tathāgatappavedito</b> dhammavinayo loke dibbati.",MN40,cūḷāssapurasuttaṃ,"evam'eva kho, bhikkhave, vessakulā ce'pi agārasmā anagāriyaṃ pabbajito hoti, so ca <b>tathāgatappaveditaṃ</b> dhammavinayaṃ āgamma, evaṃ mettaṃ karuṇaṃ muditaṃ upekkhaṃ bhāvetvā labhati ajjhattaṃ vūpasamaṃ.",MN33,mahāgopālakasuttaṃ,"idha, bhikkhave, bhikkhu <b>tathāgatappavedite</b> dhammavinaye desiyamāne na labhati atthavedaṃ, na labhati dhammavedaṃ, na labhati dhamm'ūpasaṃhitaṃ pāmojjaṃ.",MN70,kīṭāgirisuttaṃ,<b>tathāgatappaveditā</b> c'assa dhammā paññāya vodiṭṭhā honti vocaritā.
tathāgatabhāsita,adj,spoken by the Buddha; preached by the Buddha,SN20.7,āṇisuttaṃ,"ye te suttantā <b>tathāgatabhāsitā</b> gambhīrā gambhīr'atthā lok'uttarā suññatappaṭisaṃyuttā, tesu bhaññamānesu na sussūsissanti na sotaṃ odahissanti",,,,,,,,,
dussīla 1,adj,unprincipled; immoral; of bad behaviour,DHP110,sahassavaggo,"yo ca vassasataṃ jīve,
<b>dussīlo</b> asamāhito,
ek'āhaṃ jīvitaṃ seyyo,
sīlavantassa jhāyino.",DHP320,nāgavaggo,"ahaṃ nāgo'va saṅgāme,
cāpato patitaṃ saraṃ,
ativākyaṃ titikkhissaṃ,
<b>dussīlo</b> hi bahujjano.",AN5.157,dukkathāsuttaṃ,"<b>dussīlo</b>, bhikkhave, sīlakathāya kacchamānāya abhisajjati kuppati byāpajjati patitthīyati kopañ'ca dosañ'ca appaccayañ'ca pātukaroti.",AN2.33,samacittavaggo,"yo ca kho mātāpitaro <b>dussīle</b> sīlasampadāya samādapeti niveseti patiṭṭhāpeti, .. ettāvatā kho mātāpitūnaṃ katañ'ca hoti paṭikatañ'ca"
dūra 1,adj,far away (from); distant (from),AN5.23,upakkilesasuttaṃ,"so sace ākaṅkhati, dibbāya sotadhātuyā visuddhāya atikkantamānusikāya ubho sadde suṇeyyaṃ, dibbe ca mānuse ca ye <b>dūre</b> santike cā'ti, tatra tatr'eva sakkhibhabbataṃ pāpuṇāti sati sati āyatane.",TH206,vijitasenattheragāthā,"satiyā taṃ nibandhissaṃ,
payutto te damessāmi,
vīriyadhuraniggahito,
na yito <b>dūraṃ</b> gamissase cittā'ti.",MN70,kīṭāgirisuttaṃ,"kīva <b>dūr'</b>ev'ime, bhikkhave, moghapurisā apakkantā imamhā dhammavinayā.",,,
