id,pali_1,example_1
14369,bhāyati 2,"sabbe tasanti daṇḍassa, sabbe <b>bhāyanti</b> maccuno,<br/>attānaṃ upamaṃ katvā, na haneyya na ghātaye."
13982,bhārasutta,handa mayaṃ <b>bhārasutta</b>gāthāyo bhaṇāmase
14185,bhāvanāmaya,"kusalā cetanā kām'āvacarā rūp'āvacarā dānamayā sīlamayā <b>bhāvanāmayā</b>, ayaṃ vuccati puññ'ābhisaṅkhāro."
14493,bhikkhugaṇanā,"utu'kkhānañ'ca, <b>bhikkhugaṇanā</b>'ca, bhikkhunīnam'ovādo cā'ti."
14507,bhikkhunisaṅgha,"upāsakā bhikkhunisaṅghassa cīvar'atthāya chandakaṃ saṃharitvā, aññatarassa pāvārikassa ghare parikkhāraṃ nikkhipitvā, bhikkhuniyo upasaṅkamitvā etadavocuṃ"
14582,bhiṅkāra,atha kho rājā māgadho seniyo bimbisāro sovaṇṇamayaṃ <b>bhiṅkāraṃ</b> gahetvā bhagavato oṇojesi
14586,bhinnaka 1,"dhammo padīpo viya tassa satthuno, yo magga-pāk'āmata-bheda-bhinnako, lok'uttaro yo ca tadattha'dīpano"
14740,bhujaga,"nandopananda<b>bhujagaṃ</b> vibudhaṃ mah'iddhiṃ, puttena therabhujagena dam'āpayanto, iddh'ūpadesavidhinā jitavā mun'indo"
31757,macchamaṃsa,"na jānaṃ uddissakataṃ maṃsaṃ paribhuñjitabbaṃ. yo paribhuñjeyya āpatti dukkaṭassa. anujānāmi tikoṭiparisuddhaṃ <b>macchamaṃsaṃ</b>, adiṭṭhaṃ assutaṃ aparisaṅkitan'ti."
32588,majjhatta 2,"brahmamārā ca indā ca lokapālā ca devatā, yamo, mittā manussā ca <b>majjhattā</b> verikā'pi ca, sabbe sattā sukhī hontu."
32616,majjhimapaṭipadā,"ete kho, bhikkhave, ubho ante anupagamma <b>majjhimā</b> <b>paṭipadā</b> tathāgatena abhisambuddhā cakkhukaraṇī ñāṇakaraṇī upasamāya abhiññāya sambodhāya nibbānāya saṃvattati"
33144,mañjiṭṭha,seyyathā'pi udapatto saṃsaṭṭho lākhāya vā haliddiyā vā nīliyā vā <b>mañjiṭṭhāya</b> vā. tattha cakkhumā puriso sakaṃ mukhanimittaṃ paccavekkhamāno yathābhūtaṃ na jāneyya na passeyya.
33179,maññati 1,yāvakīvañ'ca bhikkhave bhikkhū ye te bhikkhū therā rattaññū cirapabbajitā saṅghapitaro saṅghapariṇāyakā te sakkarissanti garuṃ karissanti mānessanti pūjessanti tesañ'ca sotabbaṃ <b>maññissanti</b>
33022,maṇḍapeyya,"<b>maṇḍapeyyam</b>'idaṃ, bhikkhave, brahmacariyaṃ, satthā sammukhībhūto."
33637,mattā 2,"sītavātaparittāṇaṃ, hirikopīnachādanaṃ.<br/><b>matt'</b>aṭṭhiyaṃ abhuñjiṃsu, santuṭṭhā itar'ītare."
33680,mattika,"idaṃ te, tāta sudinna, mātu mattikaṃ, itthikāya itthidhanaṃ, aññaṃ pettikaṃ aññaṃ pitāmahaṃ."
31882,madhuragga 2,"ambil'aggehi'pi, tittak'aggehi'pi, kaṭuk'aggehi'pi, <b>madhur'aggehi</b>'pi, khārikehi'pi, akhārikehi'pi, loṇikehi'pi, aloṇikehi'pi."
32935,manasikaritvā,rattiyā majjhimaṃ yāmaṃ dakkhiṇena passena sīhaseyyaṃ kappeyyāsi pāde pādaṃ accādhāya sato sampajāno uṭṭhānasaññaṃ <b>manasikaritvā</b>
32788,mamaccayena,"yo vo, ānanda, mayā dhammo ca vinayo ca desito paññatto, so vo <b>mam'accayena</b> satthā."
32792,mamaṃ 2,"ye santāne hīnā dhammā, yāva nibbānato <b>mamaṃ</b> nassantu sabbadā y'eva."
33451,maraṇapariyosāna,"addhuvaṃ me jīvitaṃ, dhuvaṃ me maraṇaṃ, avassaṃ mayā maritabbaṃ, <b>maraṇapariyosānaṃ</b> me jīvitaṃ, jīvitaṃ me aniyataṃ , maraṇaṃ me niyataṃ"
33501,mari,"sabbe sattā maranti ca <b>mariṃsu</b> ca marissare, tath'ev'āhaṃ marissāmi, n'atthi me ettha saṃsayo"
33515,maritabba,"addhuvaṃ me jīvitaṃ, dhuvaṃ me maraṇaṃ, avassaṃ mayā <b>maritabbaṃ</b>, maraṇapariyosānaṃ me jīvitaṃ, jīvitaṃ me aniyataṃ , maraṇaṃ me niyataṃ"
32242,mahaṇṇava,"buddho susuddho karuṇā<b>mah'aṇṇavo</b>, yo'ccantasuddhabbarañāṇalocano, lokassa pāp'ūpakilesaghātako"
32415,mahattamabhikaṅkhatā,"tasmā hi attakāmena, <b>mahattam'abhikaṅkhatā</b>. <br/>saddhammo garukātabbo, saraṃ buddhāna sāsanan'ti."
32179,mahallikā 1,"tassā hi nāma, āvuso, bāhirāya pathavīdhātuyā tāva <b>mahallikāya</b> aniccatā paññāyissati, khayadhammatā paññāyissati, vayadhammatā paññāyissati, vipariṇāmadhammatā paññāyissati."
32265,mahāpajāpati,ekam'antaṃ ṭhitā kho sā <b>mahāpajāpatī</b> gotamī bhagavantaṃ etad'avoca
32020,mahābandhana,"mutt'āhaṃ sabbapāsehi, ye dibbā ye ca mānusā.<br/><b>mahābandhana</b>mutto'mhi, nihato tvam'asi antakā'ti."
32483,mahāya,"sace pan'āyaṃ kulaputto <b>mah'āyo</b> samāno kasiraṃ jīvikaṃ kappeti, tassa bhavanti vattāro, ajaddhumārikaṃ v'āyaṃ kulaputto marissatī'ti"
31917,māgasira,"ayaṃ vasabhasaṃvacchare hem'antautu. asmiṃ utumhi <b>māgasira</b>māsassa kāḷapakkhe catutthaṃ, ravivāram'idan'ti daṭṭhabbaṃ."
31996,māgha 2,"ayaṃ vasabhasaṃvacchare hem'antautu. asmiṃ utumhi <b>māgha</b>māsassa kāḷapakkhe catutthaṃ, ravivāram'idan'ti daṭṭhabbaṃ."
33594,mātaraṃ,"<b>mātaraṃ</b> pitaraṃ hantvā, rājāno dve ca khattiye,<br/>raṭṭhaṃ sānucaraṃ hantvā, anīgho yāti brāhmaṇo."
71041,mātāpitūpaṭṭhāna,"<b>mātāpit'ūpaṭṭhānaṃ</b>, puttadārassa saṅgaho.<br/>anākulā ca kamm'antā, etaṃ maṅgalam'uttamaṃ."
33700,mātucitta,"etha tumhe, bhikkhave, mātumattīsu mātucittaṃ upaṭṭhapetha, bhaginimattīsu bhaginicittaṃ upaṭṭhapetha, dhītumattīsu dhītucittaṃ upaṭṭhapethā'ti."
33726,mātumattī,"etha tumhe, bhikkhave, mātumattīsu mātucittaṃ upaṭṭhapetha, bhaginimattīsu bhaginicittaṃ upaṭṭhapetha, dhītumattīsu dhītucittaṃ upaṭṭhapethā'ti."
33326,mānusiya,"tasmā hi bhūtā nisāmetha sabbe, mettaṃ karotha mānusiyā pajāya.<br/>divā ca ratto ca haranti ye baliṃ, tasmā hi ne rakkhatha appamattā."
33756,māyaṃ vidaṃseti,"seyyathā'pi, bhikkhave, māyākāro vā māyākār'antevāsī vā catumahāpathe <b>māyaṃ vidaṃseyya.</b>"
33750,māyākārantevāsī,"seyyathā'pi, bhikkhave, māyākāro vā <b>māyākār'antevāsī</b> vā catumahāpathe māyaṃ vidaṃseyya."
33424,mārāmisa,vipariṇāmadhammato asārakato aghamūlato vadhakato vibhavato sāsavato saṅkhatato mār'āmisato
32732,mālavant,"ukkhittakhaggamatihatthasudāruṇan'taṃ, dhāvan'tiyojanapath'aṅguli<b>mālavantaṃ</b>. iddhī'bhisaṅkhatamano jitavā mun'indo."
31732,mā ahosi,"yasmā ca kho, bhikkhave, rūpaṃ anattā, tasmā rūpaṃ ābādhāya saṃvattati, na ca labbhati rūpe, evaṃ me rūpaṃ hotu, evaṃ me rūpaṃ <b>mā ahosī'</b>ti."
71039,mā pamādattha,"etāni, bhikkhave, rukkhamūlāni, etāni suññ'āgārāni. jhāyatha, bhikkhave, <b>mā</b> <b>pamād'attha</b>, mā pacchā vippaṭisārino ahuvattha. ayaṃ vo amhākaṃ anusāsanī'ti."
33970,micchatta 2,<b>micchatta</b>niyatā dhammā. sammattaniyatā dhammā. aniyatā dhammā
34058,mīḷhapabbata,yam'pi tathāgato arahaṃ sammāsambuddho pubb'eva sambodhā anabhisambuddho bodhisatto'va samāno mahato mīḷhapabbatassa upar'ūpari caṅkamati alippamāno mīḷhena
34308,mucci 2,"ekasmiṃ samaye nātho moggallānañ'ca kassapaṃ gilāne dukkhite disvā, bojjh'aṅge satta desayi. te ca taṃ abhinanditvā rogā <b>mucciṃsu</b> taṅ'khaṇe."
34657,muṭṭhasacca,so an'upārambhacitto samāno bhabbo <b>muṭṭhassaccaṃ</b> pahātuṃ asampajaññaṃ pahātuṃ cetaso vikkhepaṃ pahātuṃ.
34564,muninda,"bāhuṃ sahassam'abhinimmita sāvudhan'taṃ, grīmekhalaṃ uditaghorasasenamāraṃ, dān'ādidhammavidhinā jitavā <b>mun'indo</b>, tan'tejasā bhavatu te jayamaṅgalāni"
34582,musala 2,dutiyo <b>musalo</b> paripatitvā aññatarassa dārakassa matthake avatthāsi. so kālamakāsi.
33871,mettacittena,"kālena ca bhāsitā hoti, saccā ca bhāsitā hoti, saṇhā ca bhāsitā hoti, atthasaṃhitā ca bhāsitā hoti, <b>mettacittena</b> ca bhāsitā hoti."
33880,mettāpāramī,"aṭṭhamaṃ adhiṭṭhāna-pārami, navamaṃ mettāpārami, dasamaṃ upekkhā-pāramī'ti"
34251,momūha,"varaṃ, bhikkhave, sottaṃ. sottaṃ kho pan'āhaṃ, bhikkhave, vañjhaṃ jīvitānaṃ vadāmi, aphalaṃ jīvitānaṃ vadāmi, momūhaṃ jīvitānaṃ vadāmi"
34278,mosalla,"ahaṃ, bhante, pāpakammaṃ akāsiṃ gārayhaṃ mosallaṃ, yena me āyasmanto attamanā honti taṃ karomī'ti."
69576,yaṅkiñci,<b>yaṅ'kiñci</b> rūpaṃ atīt'ānāgatapaccuppannaṃ ajjhattaṃ vā bahiddhā vā oḷārikaṃ vā sukhumaṃ vā
69764,yathāpaññatta,"yāvakīvañ'ca bhikkhave bhikkhū apaññattaṃ na paññāpessanti, paññattaṃ na samucchindissanti, <b>yathāpaññattesu</b> sikkhāpadesu samādāya vattissanti"
69800,yathāsanthatikaṅga,"aṭṭha dhut'aṅgāni, āraññik'aṅgaṃ, piṇḍapātik'aṅgaṃ, paṃsukūlik'aṅgaṃ, tecīvarik'aṅgaṃ, sapadānacārik'aṅgaṃ, khalupacchābhattik'aṅgaṃ, nesajjik'aṅgaṃ, yathāsanthatik'aṅgaṃ, idaṃ vuccati vataṃ, na sīlaṃ."
71821,yānī 2,mettāya cetovimuttiyā āsevitāya bhāvitāya bahulīkatāya y<b>ānī</b>katāya vatthukatāya anuṭṭhitāya paricitāya susamāraddhāya ekādas'ānisaṃsā pāṭikaṅkhā.
69945,yāyaṃ 2,<b>yāyaṃ</b> taṇhā ponobbhavikā nandirāgasahagatā tatratatr'ābhinandinī seyyath'īdaṃ kāmataṇhā bhavataṇhā vibhavataṇhā
69999,yeva,"diṭṭhā vā <b>y'eva</b> adiṭṭhā, ye сa dūre vasanti avidūre <br/>bhūtā vā sambhav'esī vā, sabbe sattā bhavantu sukhit'attā."
70013,yobbañña,"bhavasātabaddhā'ti. ekaṃ bhavasātaṃ, sukhā vedanā. dve bhavasātāni, sukhā ca vedanā iṭṭhañ'ca vatthu. tīṇi bhavasātāni, y<b>obbaññaṃ</b>, ārogyaṃ, jīvitaṃ."
48387,rakkhasa,"te kilesā pavaḍḍhantā, āvisanti bahuṃ janaṃ.<br/>kīḷanti maññe bālehi, ummattehi'va <b>rakkhasā</b>."
48395,rakkhetha,"sududdasaṃ sunipuṇaṃ, yatthakāma-nipātino,<br/>cittaṃ rakkhetha medhāvī, cittaṃ guttaṃ sukh'āvahaṃ."
48367,rajopatha,sambādho ghar'āvāso <b>rajopatho</b> abbhokāso pabbajjā.
48338,rajjana,n'āhaṃ taṃ pamāṇaṃ atikkamitvā <b>rajjan</b>'ādivasena uppajjituṃ dassāmī'ti evam'ettha attho daṭṭhabbo.
48665,raṭṭhapāla,"atha kho āyasmā <b>raṭṭhapālo</b> sakapitu nivesane n'eva dānaṃ alattha na paccakkhānaṃ, añña'd'atthu akkosam'eva alattha"
48667,raṭṭhapālattheragāthā,handa mayaṃ <b>raṭṭhapālattheragāthāyo</b> bhaṇāmase
48576,ratanattaya,"icc'evam accantanamassanīyaṃ namassamāno <b>ratanattayaṃ</b> yaṃ puññ'ābhisandaṃ vipulaṃ alatthaṃ, tass'ānubhāvena hat'antarāyo."
48622,rathikāya rathikaṃ,kharassarena paṇavena rathikāya rathikaṃ siṅghāṭakena siṅghāṭakaṃ parinetvā dakkhiṇena dvārena nikkhāmetvā dakkhiṇato nagarassa sīsaṃ chindathā'ti.
48428,ramaṇīya 2,"<b>ramaṇīyāni</b> araññāni, yattha na ramatī jano,<br/>vītarāgā ramissanti, na te kāmagavesino."
48516,rasapathavī,"tesaṃ rasapathaviṃ aṅguliyā sāyataṃ acchādesi, taṇhā ca tesaṃ okkami."
48520,rasappaṭisaṃvedī,"puna caparaṃ, upavāṇa, bhikkhu jivhāya rasaṃ sāyitvā rasappaṭisaṃvedī ca hoti rasarāga-ppaṭisaṃvedī ca."
48521,rasarāga,"puna caparaṃ, upavāṇa, bhikkhu jivhāya rasaṃ sāyitvā rasappaṭisaṃvedī ca hoti rasarāga-ppaṭisaṃvedī ca."
48523,rasarāgappaṭisaṃvedī,"puna caparaṃ, upavāṇa, bhikkhu jivhāya rasaṃ sāyitvā rasappaṭisaṃvedī ca hoti rasarāgappaṭisaṃvedī ca."
48712,ravi 2.1,"ayaṃ vasabhasaṃvacchare hem'antautu. asmiṃ utumhi māghamāsassa kāḷapakkhe catutthaṃ, <b>ravi</b>vāram'idan'ti daṭṭhabbaṃ."
48170,rājā,"no ce labhetha nipakaṃ sahāyaṃ, saddhiṃcaraṃ sādhuvihāridhīraṃ,<br/><b>rājā</b>'va raṭṭhaṃ vijitaṃ pahāya, eko care mātaṅg'araññ'eva nāgo."
48180,rājābhinīta,"tañ'ca kho etaṃ, bhikkhave, kulaputtā upenti atthavasikā, atthavasaṃ paṭicca; n'eva rāj'ābhinītā, na cor'ābhinītā, na iṇ'aṭṭā, na bhayaṭṭā, na ājīvikāpakatā"
48372,rājūhi,catūhi mahādeva-rājūhi kat'āradhanaṃ paṭicca pañca mahāvilokane viloketvā
48066,rādha,"sāvatthinidānaṃ. atha kho āyasmā <b>rādho</b> yena bhagavā ten'upasaṅkami, upasaṅkamitvā bhagavantaṃ etad'avoca"
48913,rukkhamūlikaṅga,ek'āsanik'aṅgaṃ pattapiṇḍik'aṅgaṃ khalupacchābhattik'aṅgaṃ āraññik'aṅgaṃ rukkhamūlik'aṅgaṃ abbhokāsik'aṅgaṃ sosānik'aṅgaṃ
48932,rumhaniya,"saddhassa, bhikkhave, sāvakassa satthusāsane pariyogāya vattato <b>rumhaniyaṃ</b> satthusāsanaṃ hoti ojavantaṃ."
48992,rūpakkhandha,"pañcakkhandhā, <b>rūpakkhandho</b> vedanākkhandho saññākkhandho saṅkhārakkhandho viññāṇakkhandho."
49027,rūpappaṭisaṃvedī,"idha pana, upavāṇa, bhikkhu cakkhunā rūpaṃ disvā rūpappaṭisaṃvedī ca hoti rūparāga-ppaṭisaṃvedī ca."
48996,rūpamaya,"cakkhu, bhikkhave, purisassa samuddo; tassa rūpamayo vego."
49032,rūparāgappaṭisaṃvedī,"idha pana, upavāṇa, bhikkhu cakkhunā rūpaṃ disvā rūpa-ppaṭisaṃvedī ca hoti rūparāgappaṭisaṃvedī ca."
48942,rūpā,"taṃ kiṃ maññasi ye te cakkhuviññeyyā rūpā adiṭṭhā adiṭṭhapubbā, na ca passasi, na ca te hoti passeyyan'ti? atthi te tattha chando vā rāgo vā pemaṃ vā'ti?"
49086,rūpāvacara,"kusalā cetanā kām'āvacarā <b>rūp'āvacarā</b> dānamayā sīlamayā bhāvanāmayā, ayaṃ vuccati puññ'ābhisaṅkhāro."
49129,rūpūpādānakkhandha,"seyyath'īdaṃ <b>rūp'ūpādānakkhandho</b>, vedan'ūpādānakkhandho, saññ'ūpādānakkhandho, saṅkhār'ūpādānakkhandho, viññāṇ'ūpādānakkhandho"
48796,rohitassa,"bhūtapubb'āhaṃ, bhante, <b>rohitasso</b> nāma isi ahosiṃ bhojaputto iddhimā vehāsaṅ'gamo."
31006,lābhasakkārasilokapaṭisaṃyutta,amarā-vitakkavaḍḍhanaṃ par'ānudayatā-paṭisaṃyutta-vitakkavaḍḍhanaṃ lābhasakkārasilokapaṭisaṃyutta-vitakkavaḍḍhanaṃ
31015,lābhena lābhaṃ nijigiṃsanatā,"kuhanā, lapanā, nemittikatā, nippesikatā, lābhena lābhaṃ nijigiṃsanatā, ayaṃ, bhikkhave, micchāājīvo"
31170,lālappa,"ādevitattaṃ paridevitattaṃ palāpo vippalāpo <b>lālappo</b> lālappanā lālappitattaṃ, ayaṃ vuccati paridevo."
31171,lālappanā,"ādevitattaṃ paridevitattaṃ palāpo vippalāpo lālappo <b>lālappanā</b> lālappitattaṃ, ayaṃ vuccati paridevo."
31172,lālappitatta,"ādevitattaṃ paridevitattaṃ palāpo vippalāpo lālappo lālappanā <b>lālappitattaṃ</b>, ayaṃ vuccati paridevo."
31676,luddha 2,"passāmi loke sadhane manusse, laddhāna vittaṃ na dadanti mohā. <br/><b>luddhā</b> dhanaṃ sannicayaṃ karonti, bhiyyo'va kāme abhipatthayanti."
31542,lokapāla,"brahmamārā ca indā ca <b>lokapālā</b> ca devatā, yamo, mittā manussā ca majjhattā verikā'pi ca, sabbe sattā sukhī hontu."
31524,lokāmisādhimutta,"evam'eva kho, sunakkhatta, ṭhānam'etaṃ vijjati yaṃ idh'ekacco purisapuggalo <b>lok'āmis'ādhimutto</b> assa."
31628,lomaṃ pāteti,"na sammā vattati, na <b>lomaṃ</b> <b>pāteti</b>, na netthāraṃ vattati, yena saṅgho attamano hoti taṃ karomī'ti n'āha."
55266,saūmi,"yo taṃ rūpamayaṃ vegaṃ sahati, ayaṃ vuccati, bhikkhave, atari cakkhusamuddaṃ saūmiṃ sāvaṭṭaṃ sagāhaṃ sarakkhasaṃ."
50331,sakkatvā,"<b>sakkatvā</b> dhammaratanaṃ, osadhaṃ uttamaṃ varaṃ, pariḷāh'ūpasamanaṃ. dhammatejena sotthinā nassant'upaddavā sabbe, bhayā vūpasamentu te."
49866,sagāha 2,"yo taṃ rūpamayaṃ vegaṃ sahati, ayaṃ vuccati, bhikkhave, atari cakkhusamuddaṃ saūmiṃ sāvaṭṭaṃ <b>sagāhaṃ</b> sarakkhasaṃ."
49910,saggasaṃvattanika,tathārūpesu samaṇabrāhmaṇesu uddh'aggikaṃ dakkhiṇaṃ patiṭṭhāpeti sovaggikaṃ sukhavipākaṃ <b>saggasaṃvattanikaṃ</b>.
53540,saṅkaḍḍhati,"lesakappe pariyāye, parikappe'nudhāvitā.<br/>jīvik'atthā upāyena, <b>saṅkaḍḍhanti</b> bahuṃ dhanaṃ."
53545,saṅkama,"taṃ kiṃ maññasi, bhaddāli, idh'assa bhikkhu ubhatobhāgavimutto, tam'ahaṃ evaṃ vadeyyaṃ, ehi me tvaṃ, bhikkhu, paṅke <b>saṅkamo</b> hohī'ti"
53562,saṅkampi,ayañ'ca dasasahassī lokadhātu <b>saṅkampi</b> sampakampi sampavedhi appamāṇo ca oḷāro obhāso loke pāturahosi atikkamm'eva devānaṃ dev'ānubhāvaṃ.
53787,saṅkiliṭṭha,"yaṃkiñci sithilaṃ kammaṃ, <b>saṅkiliṭṭhañ</b>'ca yaṃ vataṃ, <br/>saṅkassaraṃ brahmacariyaṃ, na taṃ hoti mahapphalan'ti"
53783,saṅkilesika,saṅkiliṭṭha<b>saṅkilesikā</b> dhammā.<br/>asaṅkiliṭṭhasaṅkilesikā dhammā.<br/>asaṅkiliṭṭh'āsaṅkilesikā dhammā.
53661,saṅkhārakkhandha,"pañcakkhandhā, rūpakkhandho vedanākkhandho saññākkhandho <b>saṅkhārakkhandho</b> viññāṇakkhandho."
53359,saṅghakaraṇīya,"yāvakīvañ'ca bhikkhave bhikkhū samaggā sannipatissanti, samaggā vuṭṭhahissanti, samaggā <b>saṅghakaraṇīyāni</b> karissanti"
53438,saṅghuposatha,yāvatikā ca bhikkhū kammappattā <b>saṅgh'uposatha</b>arahā cattāro vā tato vā atirekā pakatattā pārājikaṃ anāpannā saṅghena vā anukkhittā.
49585,sacittapariyodapanā,"sabbapāpassa akaraṇaṃ, kusalass'ūpasampadā. <br/><b>sacittapariyodapanaṃ</b>, etaṃ buddhāna sāsanaṃ."
49530,saccapāramī,"catutthaṃ paññā-pārami, pañcamaṃ viriya-pārami, chaṭṭhamaṃ khanti-pārami, sattamaṃ saccapārami"
53490,sañjagghati,api ca kho mātugāmena saddhiṃ <b>sañjagghati</b> saṃkīḷati saṃkeḷāyati
53505,sañjaneti,sayaṃ samattaṃ karoti paripuṇṇaṃ karoti anomaṃ karoti aggaṃ seṭṭhaṃ visiṭṭhaṃ pāmokkhaṃ uttamaṃ pavaraṃ karoti janeti <b>sañjaneti</b> nibbatteti abhinibbattetī'ti
53848,saññākkhandha,"pañcakkhandhā, rūpakkhandho vedanākkhandho <b>saññākkhandho</b> saṅkhārakkhandho viññāṇakkhandho."
53914,saññāvedayita,"te ca h'āvuso, āyusaṅkhārā abhaviṃsu te vedaniyā dhammā, na'y'idaṃ <b>saññāvedayita</b>nirodhaṃ samāpannassa bhikkhuno vuṭṭhānaṃ paññāyetha."
54009,saññita,"saṅgho sukhett'ābhyatikhetta<b>saññito</b>, yo diṭṭhasanto sugat'ānubodhako, lolappahīno ariyo sumedhaso"
54032,saññoga,"nanu mayā, moghapurisa, anekapariyāyena virāgāya dhammo desito no sarāgāya, visaññogāya dhammo desito no <b>saññogāya</b>, anupādānāya dhammo desito no saupādānāya!"
54943,satipārisuddhi,"sukhassa ca pahānā dukkhassa ca pahānā, pubb'eva somanassadomanassānaṃ atthaṅ'gamā, adukkham'asukhaṃ upekkhā<b>satipārisuddhiṃ</b> catutthaṃ jhānaṃ upasampajja viharati."
55108,sattati,"yesaṃ <b>sattati</b> piyāni, <b>sattati</b> tesaṃ dukkhāni, <br/>yesaṃ saṭṭhi piyāni, saṭṭhi tesaṃ dukkhāni, <br/>yesaṃ paññāsaṃ piyāni, paññāsaṃ tesaṃ dukkhāni"
55111,sattatiṃsati,"idāni kho pana dve-sahassa-pañca-sata-sattatiṃsati saṃvaccharāni c'eva, navamāsāni ca, catuvīsati-divasāni atikkantāni."
55063,sattannaṃ 1,"katā me rakkhā katā me parittā, paṭikkamantu bhūtāni.<br/>so'haṃ namo bhagavato, namo <b>sattannaṃ</b> sammāsambuddhānaṃ"
54989,sattabojjhaṅgā,cattāro satipaṭṭhānā bhāvitā bahulīkatā <b>sattabojjh'aṅge</b> paripūrenti.
55081,sattarasa 1,"idāni kho pana dvesahassapañcasatatesaṭṭhi saṃvaccharāni c'eva, navamāsāni ca, <b>sattarasa</b>divasāni atikkantāni."
55133,sattavīsati,"idāni kho pana dvesahassapañcasatatesaṭṭhi saṃvaccharāni c'eva, navamāsāni ca, <b>sattavīsati</b>divasāni atikkantāni."
55151,satthaka 1,"upakkhalitvā vā papateyyaṃ, bhattaṃ vā me bhuttaṃ byāpajjeyya, pittaṃ vā me kuppeyya, semhaṃ vā me kuppeyya, <b>satthakā</b> vā me vātā kuppeyyuṃ"
49594,sad,so taṃ dhammaṃ sutvā tathāgate <b>sad</b>dhaṃ paṭilabhati. so tena <b>sad</b>dhāpaṭilābhena samannāgato iti paṭisañcikkhati
49849,sadosa 2.1,asaṃvutaṃ hutvā osaramānaṃ kiles'uppattiyā kāraṇabhāvena <b>sadosa</b>gamanena gacchatī'ti samuddan'aṭṭhena'pi samuddo.
49653,saddappaṭisaṃvedī,"puna caparaṃ, upavāṇa, bhikkhu sotena saddaṃ sutvā saddappaṭisaṃvedī ca hoti saddarāga-ppaṭisaṃvedī ca."
49655,saddarāga,"puna caparaṃ, upavāṇa, bhikkhu sotena saddaṃ sutvā saddappaṭisaṃvedī ca hoti saddarāga-ppaṭisaṃvedī ca."
49656,saddarāgappaṭisaṃvedī,"puna caparaṃ, upavāṇa, bhikkhu sotena saddaṃ sutvā saddappaṭisaṃvedī ca hoti saddarāgappaṭisaṃvedī ca."
49708,saddhammamaññāya,"sabbhi'r'eva samāsetha,<br/>sabbhi kubbetha santhavaṃ,<br/>sataṃ <b>saddhammam'aññāya</b>,<br/>seyyo hoti na pāpiyo'ti."
49695,saddhājāta,"idha saddhājāto upasaṅkamati, upasaṅkamanto payirupāsati, payirupāsanto sotaṃ odahati, ohitasoto dhammaṃ suṇāti, sutvā dhammaṃ dhāreti, dhatānaṃ dhammānaṃ atthaṃ upaparikkhati"
49690,saddhādeyya,yathā vā pan'eke bhonto samaṇabrāhmaṇā <b>saddhādeyyāni</b> bhojanāni bhuñjitvā te evarūpaṃ tiracchānakathaṃ anuyuttā viharanti.
49722,saddhāpabbajita,alam'eva <b>saddhāpabbajitena</b> kulaputtena vīriyaṃ ārabhituṃ
49733,saddhāvimutta,"<b>saddhāvimutto</b>  idha ekacco puggalo ye te santā vimokkhā atikkamma rūpe āruppā te na kāyena phusitvā viharati, paññāya c'assa disvā ekacce āsavā parikkhīṇā honti, tathāgate c'assa saddhā niviṭṭhā hoti mūlajātā patiṭṭhitā."
49763,sadhamma,"tam'mayaṃ bhagavantaṃ <b>sadhammaṃ</b> sasaṅghaṃ, imehi sakkārehi yath'ārahaṃ āropitehi abhipūjayāma"
53474,sanidassana,<b>sanidassana</b>sappaṭighā dhammā. anidassanasappaṭighā dhammā. anidassan'āppaṭighā dhammā.
54088,santappati 2.1,"jīno rath'assaṃ maṇikuṇḍale ca, putte ca dāre ca that'eva jīno.<br/>sabbesu bhogesu asesitesu, kasmā na <b>santappasi</b> sokakāle."
54110,santaruttaraparamaṃ,"tañ'ce aññātako gahapati vā gahapatānī vā bahūhi cīvarehi abhihaṭṭhuṃ pavāreyya, <b>santar'uttaraparamaṃ</b> tena bhikkhunā tato cīvaraṃ sāditabbaṃ."
54062,santaṃ,"idha bhikkhu <b>santaṃ</b> vā ajjhattaṃ kāmacchandaṃ atthi me ajjhattaṃ kāmacchando'ti pajānāti, asantaṃ vā ajjhattaṃ kāmacchandaṃ n'atthi me ajjhattaṃ kāmacchando'ti pajānāti"
54246,santīraṇa,diṭṭhamattaṃ nāma tatth'eva uppannaṃ sampaṭicchana<b>santīraṇa</b>voṭṭhabbanasaṅkhātaṃ cittattayaṃ.
54146,santesu,"yathā hi aṅga-sambhārā, hoti saddo ratho iti.<br/>evaṃ khandhesu santesu, hoti satto'ti sammuti"
53962,sannipata,"ettāni cattāri vattāni sammajjanakaraṇ'ādīni saṅgha<b>sannipatato</b> paṭhamaṃ kattabbatā, uposathassa uposathakammassa pubbakaraṇan'ti vuccati. pubbakaraṇānī'ti akkhātāni."
53968,sannipātabahula,"yāvakīvañ'ca bhikkhave bhikkhū abhiṇhaṃ sannipātā bhavissanti <b>sannipātabahulā</b>, vuddhi'y'eva pāṭikaṅkhā no parihāni"
54334,sapattavatā,"kathañ'c'ānanda, satthāraṃ sāvakā mittavatāya samudācaranti, no sapattavatāya?"
54294,sapadānacārika,"aṭṭha dhut'aṅgāni, āraññik'aṅgaṃ, piṇḍapātik'aṅgaṃ, paṃsukūlik'aṅgaṃ, tecīvarik'aṅgaṃ, sapadānacārik'aṅgaṃ, khalupacchābhattik'aṅgaṃ, nesajjik'aṅgaṃ, yathāsanthatik'aṅgaṃ, idaṃ vuccati vataṃ, na sīlaṃ."
54296,sapadānacārikaṅga,"aṭṭha dhut'aṅgāni, āraññik'aṅgaṃ, piṇḍapātik'aṅgaṃ, paṃsukūlik'aṅgaṃ, tecīvarik'aṅgaṃ, sapadānacārik'aṅgaṃ, khalupacchābhattik'aṅgaṃ, nesajjik'aṅgaṃ, yathāsanthatik'aṅgaṃ, idaṃ vuccati vataṃ, na sīlaṃ."
54309,saparidaṇḍā,"ñātirakkhitā gottarakkhitā dhammarakkhitā sasāmikā saparidaṇḍā antamaso mālāguḷaparikkhittā'pi, tathārūpāsu cārittaṃ āpajjitā hoti"
49380,sabbatthamaparājita,"et'ādisāni katvāna, <b>sabbattha'm'aparājitā</b>.<br/>sabbattha sotthiṃ gacchanti, taṃ tesaṃ maṅgalam'uttaman'ti."
49295,sabbapāpa,"<b>sabbapāpassa</b> akaraṇaṃ, kusalass'ūpasampadā. <br/>sacittapariyodapanaṃ, etaṃ buddhāna sāsanaṃ."
49261,sabbampidaṃ,sabbam'p'idaṃ hāyatu ca jīratu ca bhijjatu ca deha-nissitaṃ
49400,sabbe,"<b>sabbe</b> tasanti daṇḍassa, sabbesaṃ jīvitaṃ piyaṃ.<br/>attānaṃ upamaṃ katvā, na haneyya na ghātaye."
49451,sabhāva 2,"yathā hi cakkhuviññāṇaṃ rūpe rūpamattam'eva passati, na anicc'ādi<b>sabhāvaṃ</b>, evam'eva sesaṃ."
50916,samanantara 1,"hetupaccayo, ārammaṇapaccayo, adhipatipaccayo, anantarapaccayo, <b>samanantara</b>paccayo, sahajātapaccayo, aññam'aññapaccayo"
51118,samanupassamāna,"ye hi keci, bhikkhave, samaṇā vā brāhmaṇā vā anekavihitaṃ attānaṃ <b>samanupassamānā</b> samanupassanti, sabb'ete pañc'upādānakkhandhe samanupassanti, etesaṃ vā aññataraṃ."
50632,samācare,"na ca khuddaṃ <b>samācare</b> kiñci, yena viññū pare upavadeyyuṃ.<br/>sukhino vā khemino hontu, sabbe sattā bhavantu sukhit'attā."
50776,samādiyi,sambahulā bhikkhū santhatāni ujjhitvā āraññik'aṅgaṃ piṇḍapātik'aṅgaṃ paṃsukūlik'aṅgaṃ <b>samādiyiṃsu</b>
52579,samuddati,cakkhu ca tesu tesu nīl'ādīsu ārammaṇesu samuddati
52568,samuddana,"yadi duppūraṇ'aṭṭhena yadi vā samuddan'aṭṭhena samuddo, cakkhum'eva samuddo."
51559,sametta,pharitvāna mettaṃ <b>samettā</b> bhadantā avikkhittacittā parittaṃ bhaṇantu
52028,samosaṭa,yo taṃ rūpamayaṃ vegaṃ sahatī'ti yo taṃ cakkhusamudde <b>samosaṭaṃ</b> rūpamayaṃ vegaṃ
52024,samosaranta,tassa hi pathavito yāva akaniṭṭhabrahmalokā nīl'ādiārammaṇaṃ samosarantaṃ paripuṇṇabhāvaṃ kātuṃ na sakkoti
