id,pali_1,example_1
3635,akaṃsu 1,bhikkhū ghaṭikārassa kumbhakārassa āvesanaṃ uttiṇam'<b>akaṃsu.</b>
3693,akāraka,akārako'mhī'ti yo vādaṃ upeti so imehi dvīhi kāraṇehi vādaṃ upeti.
3718,akārita,"tassa mukh'ādhāne kāraṇaṃ kāriyamānassa honti y'eva visūkāyitāni visevitāni vipphanditāni kānici kānici, yathā taṃ <b>akārita</b>pubbaṃ kāraṇaṃ kāriyamānassa."
3719,akāritapubba,"tassa mukh'ādhāne kāraṇaṃ kāriyamānassa honti y'eva visūkāyitāni visevitāni vipphanditāni kānici kānici, yathā taṃ <b>akāritapubbaṃ</b> kāraṇaṃ kāriyamānassa."
3597,akālapuppha,"sabbaphāliphullā kho, ānanda, yamakasālā <b>akālapupphehi</b>. te tathāgatassa sarīraṃ okiranti ajjhokiranti abhippakiranti tathāgatassa pūjāya."
3871,akiccha,imesañ'ca catunnaṃ jhānānaṃ ābhicetasikānaṃ diṭṭhadhamma-sukhavihārānaṃ nikāmalābhī hoti akiccha-lābhī akasiralābhī.
2727,aggadhammasamāhita,"aggassa dātā medhāvī, <b>aggadhammasamāhito</b>. devabhūto manusso vā, aggappatto pamodatī'ti."
2725,aggadhamma 1,"aggassa dātā medhāvī, <b>aggadhamma</b>samāhito. devabhūto manusso vā, aggappatto pamodatī'ti."
2881,aghamūla,vipariṇāmadhammato asārakato aghamūlato vadhakato vibhavato sāsavato saṅkhatato mār'āmisato
5904,aṅgulimāla,"coro ahaṃ pure āsiṃ, <b>aṅgulimālo</b>'ti vissuto.<br/>vuyhamāno mah'oghena, buddhaṃ saraṇam'āgamaṃ."
1411,acc,"yo vo, ānanda, mayā dhammo ca vinayo ca desito paññatto, so vo mam'<b>acc</b>ayena satthā."
1524,acchati 2,"sabbakārukasippāni, cittiṃ katvāna sikkhare.<br/>avūpasantā ajjhattaṃ, sāmaññ'attho'ti <b>acchati</b> ."
1545,acchindanta,"mamāyite passatha phandamāne'ti mamāyitaṃ vatthuṃ accheda-saṃkino'pi phandanti, acchindante'pi phandanti, acchinne'pi phandanti"
3344,ajjatā,"ajja't'agge'ti ajjataṃ ādiṃ katvā, ajja'd'agge'ti vā pāṭho, da-kāro padasandhikaro, ajja aggaṃ katvā'ti vuttaṃ hoti."
3339,ajjadagge,"ajja't'agge'ti ajjataṃ ādiṃ katvā, ajja'd'agge'ti vā pāṭho, da-kāro padasandhikaro, ajja aggaṃ katvā'ti vuttaṃ hoti."
3356,ajjh,so iminā ariyena sīlakkhandhena samannāgato <b>ajjh</b>attaṃ anavajjasukhaṃ paṭisaṃvedeti
3357,ajjha,"khayaṃ virāgaṃ amataṃ paṇītaṃ, <br/>yad'<b>ajjha</b>gā sakyamunī samāhito. <br/>na tena dhammena sam'atthi kiñci"
3541,ajjhūpagata,"vevaṇṇiy'amhi <b>ajjhūpagato</b>'ti, pabbajitena abhiṇhaṃ paccavekkhitabbaṃ."
3491,ajjhogāḷha,"mohanaṃ vuccati kāmaguṇā. ettha hi devamanussā muyhanti, tesu <b>ajjhogāḷho</b> hutvā. etena bahiddhābandhanaṃ vuttaṃ."
6162,añjanamakkhita,"aṭṭhapadakatā kesā, nettā <b>añjanamakkhitā</b>. <br/>alaṃ bālassa mohāya, no ca pāragavesino."
6166,añjanī 1,"<b>añjanī</b>'va navā cittā, pūtikāyo alaṅkato. <br/>alaṃ bālassa mohāya, no ca pāragavesino."
6245,aññamaññassa,"pañc'imāni, bho gotama, indriyāni nānāvisayāni nānāgocarāni, na <b>aññam'aññassa</b> gocaravisayaṃ paccanubhonti."
6240,aññamaññābhigijjhanti,"mahaddhanā mahābhogā,<br/>raṭṭhavanto'pi khattiyā,<br/><b>aññam'aññ'ābhigijjhanti</b>,<br/>kāmesu analaṅkatā."
6272,aññārādhanā,"kathañ'ca, bhikkhave, anupubbasikkhā anupubbakiriyā anupubbapaṭipadā aññ'ārādhanā hoti?"
11711,aṭṭhatiṃsati,"idāni kho pana dve-sahassa-pañca-sata-aṭṭhatiṃsati saṃvaccharāni c'eva, navamāsāni ca, catuvīsati-divasāni atikkantāni."
11641,aṭṭhapadakata,"<b>aṭṭhapadakatā</b> kesā, nettā añjanamakkhitā. <br/>alaṃ bālassa mohāya, no ca pāragavesino."
11738,aṭṭhavīsati,"idāni kho pana dve-sahassa-pañca-sata-tesaṭṭhi saṃvaccharāni c'eva, navamāsāni ca, aṭṭhavīsati-divasāni atikkantāni."
11786,aṭṭhimiñjā,atthi imasmiṃ kāye kesā lomā nakhā dantā taco maṃsaṃ nhāru aṭṭhi <b>aṭṭhimiñjaṃ</b> vakkaṃ hadayaṃ yakanaṃ kilomakaṃ
11748,aṭṭhena,"yadi duppūraṇ'<b>aṭṭhena</b> yadi vā samuddan<b>'aṭṭhena</b> samuddo, cakkhum'eva samuddo."
5929,aṇha,"tam'enaṃ pubb'<b>aṇha</b>samayaṃ sattisatena haneyyuṃ. atha rājā majjha-<b>anh</b>ikasamayaṃ evaṃ vadeyya, ambho, kathaṃ so puriso'ti?"
10809,atandī,"etā pi buddhajayamaṅgalaaṭṭhagāthā, yo vācano dinadine sarate'm'<b>atandī</b>, hitvān'anekavividhāni c'upaddavāni, mokkhaṃ sukhaṃ adhigameyya naro sapañño"
10803,atāṇa,bhayato upasaggato calato pabhaṅguto adhuvato atāṇato aleṇato asaraṇato rittato tucchato suññato anattato ādīnavato
11247,atiuṇhaṃ,"ādīnavā ālasy'ānuyoge. atisītan'ti kammaṃ na karoti, atiuṇhan'ti kammaṃ na karoti, atisāyan'ti kammaṃ na karoti, atipāto'ti kammaṃ na karoti, atichāto'smī'ti kammaṃ na karoti"
11111,atipāto,"ādīnavā ālasy'ānuyoge. atisītan'ti kammaṃ na karoti, atiuṇhan'ti kammaṃ na karoti, atisāyan'ti kammaṃ na karoti, atipāto'ti kammaṃ na karoti, atichāto'smī'ti kammaṃ na karoti"
11066,atimatta,"nāḷāgiriṃ gajavaraṃ <b>atimatta</b>bhūtaṃ, dāv'aggicakkam'asanī'va, sudāruṇan'taṃ, mett'ambusekavidhinā jitavā mun'indo."
11192,atisītaṃ,"ādīnavā ālasy'ānuyoge. atisītan'ti kammaṃ na karoti, atiuṇhan'ti kammaṃ na karoti, atisāyan'ti kammaṃ na karoti, atipāto'ti kammaṃ na karoti, atichāto'smī'ti kammaṃ na karoti"
11215,atītasatthuka 2,"siyā kho pan'ānanda, tumhākaṃ evam'assa, <b>atītasatthukaṃ</b> pāvacanaṃ, n'atthi no satthā'ti."
11211,atītānāgate,iminā tvaṃ dhammena diṭṭhena viditena akālikena pattena pariyogāḷhena atīt'ānāgate nayaṃ nehi
11415,attanudiṭṭhi,"suññato lokaṃ avekkhassu, mogharāja sadā sato,<br/>att'ānudiṭṭhiṃ ūhacca, evaṃ maccutaro siyā,<br/>evaṃ lokaṃ avekkhantaṃ, maccurājā na passatī'ti."
11448,attasammāpaṇidhi,"paṭirūpadesavāso ca, pubbe ca katapuññatā.<br/><b>attasammāpaṇidhi</b> ca, etaṃ maṅgalam'uttamaṃ."
11564,atthaladdha,"te <b>atthaladdhā</b> sukhitā, viruḷhā buddhasāsane. arogā sukhitā hotha, saha sabbehi ñātibhī'ti."
70963,attha 4.2,"etāni, bhikkhave, rukkhamūlāni, etāni suññ'āgārāni. jhāyatha, bhikkhave, mā pamāda-<b>attha</b>, mā pacchā vippaṭisārino ahuvattha. ayaṃ vo amhākaṃ anusāsanī'ti."
11758,atthibhāva,rūparāgappaṭisaṃvedī'ti kilesassa <b>atthibhāven</b>'eva pana rūparāgaṃ paṭisaṃviditaṃ karoti nāma
10880,athaddha,"arahante sītībhūte, katakicce anāsave nihacca mānaṃ athaddho, te namasse anuttare'ti."
1778,addakkhu,"aniccaṃ aniccato dakkhuṃ, dukkham'<b>addakkhu</b> dukkhato.<br/>anattani anattā'ti, asubhaṃ asubhat'addasuṃ.<br/>sammādiṭṭhisamādānā, sabbaṃ dukkhaṃ upaccagun'ti"
1854,addhaniya,"yatha'y'idaṃ brahmacariyaṃ <b>addhaniyaṃ</b> assa ciraṭṭhitikaṃ, tadassa bahujanahitāya bahujanasukhāya lok'ānukampāya atthāya hitāya sukhāya devamanussānaṃ"
1846,addhānaṃ āpādeti,"paṭhamena vayasā anikīḷitāvino kāmesu yāvajīvaṃ paripuṇṇaṃ parisuddhaṃ brahmacariyaṃ caranti, addhānañ'ca āpādentī'ti?"
2105,adhikuṭṭana,asisūn'ūpamā kāmā adhikuṭṭan'aṭṭhenā'ti passanto vikkhambhanato kāme parivajjeti
2043,adhigameyya,"etā pi buddhajayamaṅgala-aṭṭhagāthā, yo vācano dinadine sarate'm'atandī, hitvān'anekavividhāni c'upaddavāni, mokkhaṃ sukhaṃ <b>adhigameyya</b> naro sapañño"
2010,adhiccāpattika,"idha, bhaddāli, ekacco bhikkhu adhicc'āpattiko hoti anāpattibahulo."
2221,adhiṭṭhahati 2,"ālokasaññaṃ manasi kareyyāsi, divāsaññaṃ <b>adhiṭṭhaheyyāsi</b> – yathā divā tathā rattiṃ yathā rattiṃ tathā divā. iti vivaṭena cetasā apariyonaddhena sa'p'pabhāsaṃ cittaṃ bhāveyyāsi"
2231,adhiṭṭhānapāramī,"aṭṭhamaṃ adhiṭṭhānapārami, navamaṃ mettā-pārami, dasamaṃ upekkhā-pāramī'ti"
2226,adhiṭṭhāna 3,"aṭṭhamaṃ adhiṭṭhāna-pārami, navamaṃ mettā-pārami, dasamaṃ upekkhā-pāramī'ti"
2185,adhipati 2,magg'ārammaṇā dhammā. maggahetukā dhammā. magg'<b>ādhipatino</b> dhammā
1998,adhibandha,"appamattako so kaliggaho yaṃ so akkhadhutto paṭhamen'eva kaliggahena puttam'pi jīyetha, dāram'pi jīyetha, sabbaṃ sāpateyyam'pi jīyetha, uttari'pi adhibandhaṃ nigaccheyya."
2128,adhimuccanta,"cittaṃ adhiṭṭhahanto sikkheyya, saddhāya adhimuccanto sikkheyya, vīriyaṃ paggaṇhanto sikkheyya, satiṃ upaṭṭhapento sikkheyya"
2132,adhimucchita,"paṇītaṃ yadi vā lūkhaṃ, appaṃ vā yadi vā bahuṃ.<br/>yāpan'atthaṃ abhuñjiṃsu, agiddhā n'<b>ādhimucchitā</b>."
2286,adhivattati 1,"patirūpe vase dese, ariyamittakaro siyā. <br/>sammāpaṇidhisampanno, pubbe puññakato naro. <br/>dhaññaṃ dhanaṃ yaso kitti, sukhaṃcetaṃ<b>adhivattatī</b>."
2351,adhuva,bhayato upasaggato calato pabhaṅguto <b>adhuvato</b> atāṇato aleṇato asaraṇato rittato tucchato suññato anattato ādīnavato
5539,anattani,"aniccaṃ aniccato dakkhuṃ, dukkham'addakkhu dukkhato.<br/><b>anattani</b> anattā'ti, asubhaṃ asubhat'addasuṃ.<br/>sammādiṭṭhisamādānā, sabbaṃ dukkhaṃ upaccagun'ti"
5571,anatthasañhita,yo c'āyaṃ attakilamath'ānuyogo dukkho anariyo <b>anatthasañhito</b>.
5263,anantara 2,"hetupaccayo, ārammaṇapaccayo, adhipatipaccayo, <b>anantara</b>paccayo, samanantarapaccayo, sahajātapaccayo, aññam'aññapaccayo"
5386,anāpattibahula,"idha, bhaddāli, ekacco bhikkhu adhicc'āpattiko hoti anāpattibahulo."
5379,anāpanna,"tass'etaṃ pāṭikaṅkhaṃ, <b>anāpanno</b> vā pārājikaṃ dhammaṃ na āpajjissati, āpanno vā pārājikaṃ dhammaṃ yathādhammaṃ paṭikarissati."
6026,anikīḷitāvī,"paṭhamena vayasā anikīḷitāvino kāmesu yāvajīvaṃ paripuṇṇaṃ parisuddhaṃ brahmacariyaṃ caranti, addhānañ'ca āpādentī'ti?"
6844,anudahana,tiṇ'ukk'ūpamā kāmā anudahan'aṭṭhenā'ti passanto vikkhambhanato kāme parivajjeti
6889,anudhāvita,"lesakappe pariyāye, parikappe'nudhāvitā.<br/>jīvik'atthā upāyena, saṅkaḍḍhanti bahuṃ dhanaṃ."
7157,anupādāniya,upādinn'upādāniyā dhammā. anupādinn'upādāniyā dhammā. anupādinn'<b>ānupādāniyā</b> dhammā.
7412,anuppadinna,"so ñātidhammo ca ayaṃ nidassito, petāna'pūjā ca katā uḷārā. balañ'ca bhikkhūnam'<b>anuppadinnaṃ</b>, tumhehi puññaṃ pasutaṃ anappakan'ti."
7408,anuppādenta,"manāpe rūpe rāgaṃ, amanāpe dosaṃ, asamapekkhite mohan'ti evaṃ rāg'ādikilese anuppādento upekkhakabhāvena sahati."
6779,anubodhaka,"saṅgho sukhett'ābhyatikhettasaññito, yo diṭṭhasanto sugat'<b>ānubodhako</b>, lolappahīno ariyo sumedhaso"
6803,anubyañjanaso 2,"varaṃ, bhikkhave, tattāya ayosalākāya ādittāya sampajjalitāya sajotibhūtāya cakkhu'ndriyaṃ sampalimaṭṭhaṃ, na tv'eva cakkhuviññeyyesu rūpesu <b>anubyañjanaso</b> nimittaggāho."
6804,anubyañjanassādagathita,"nimitt'assādagathitaṃ vā, bhikkhave, viññāṇaṃ tiṭṭhamānaṃ tiṭṭheyya, anubyañjan'assādagathitaṃ vā tasmiñ'ce samaye kālaṃ kareyya"
7086,anumodanā 1,"mayā dinnānapuññānaṃ <b>anumodana</b>hetunā, sabbe sattā sadā hontu averā sukhajīvino, khemappadañ'ca pappontu tesāsā sijjhataṃ subhā"
7486,anurakkhamāna,"kikī'va aṇḍaṃ, camarī'va vāladhiṃ. piyaṃ'va puttaṃ,<br/>nayanaṃ'va ekakaṃ. tath'eva sīlaṃ, anurakkhamānā."
7640,anusikkhati 2,"ye'pi tassa <b>anusikkhanti</b>, te'pi kāyassa bhedā paraṃ maraṇā apāyaṃ duggatiṃ vinipātaṃ nirayaṃ upapajjanti."
7647,anusocati,"atītaṃ na-<b>anusocanti</b>,<br/>nappajappanti n'āgataṃ,<br/>paccuppannena yāpenti,<br/>tena vaṇṇo pasīdati."
7699,anussāviyamāna,"yo pana bhikkhu, yāvatatiyaṃ <b>anussāviyamāne</b>, saramāno santiṃ āpattiṃ n'āvikareyya, sampajānamusāvād'assa hoti."
6425,anokamāgamma,"kaṇhaṃ dhammaṃ vippahāya, sukkaṃ bhāvetha paṇḍito, <br/>okā <b>anokam'āgamma</b>, viveke yattha dūramaṃ."
6403,anodhi 2,"cha, bhikkhave, ānisaṃse sampassamānena alam'eva bhikkhunā sabbadhammesu <b>anodhiṃ</b> karitvā anattasaññaṃ upaṭṭhāpetuṃ."
6492,antagaṇṭhi,jīvako … janaṃ ussāretvā tirokaraṇiyaṃ parikkhipitvā thambhe upanibandhitvā bhariyaṃ purato ṭhapetvā udara-cchaviṃ uppāṭetvā antagaṇṭhiṃ nīharitvā bhariyāya dassesi
6593,antarāyeva,aññatr'eva asitapītakhāyitasāyitā aññatra uccārapassāvakammā aññatra niddākilamathapaṭivinodanā vassasatāyuko vassasatajīvī vassasataṃ gantvā appatvā'va lokassa antaṃ antarā'y'eva kālaṅkato.
6197,annā,"ehi tvaṃ, bhikkhu, satisampajaññena sam<b>annā</b>gato hohi, abhikkante paṭikkante sampajānakārī, ālokite vilokite sampajānakārī, samiñjite pasārite sampajānakārī, saṅghāṭipattacīvaradhāraṇe sampajānakārī"
7957,anventa,"pariccajitvā saddhammaṃ, aññam'aññehi bhaṇḍare.<br/>diṭṭhigatāni anventā, idaṃ seyyo'ti maññare."
8172,apakassa 2,"seyyathā'pi, bhikkhave, puriso jar'udapānaṃ vā olokeyya pabbatavisamaṃ vā nadīviduggaṃ vā, <b>apakass</b>'eva kāyaṃ, <b>apakassa</b> cittaṃ"
8038,apaciyati,"so tathāgataṃ sakkaroti garuṃ karoti māneti pūjeti <b>apaciyati</b>, paramāya pūjāya."
8131,apajaha,"ime, bhante, licchavikumārakā caṇḍā pharusā <b>apajahā</b> ... kul'itthīnam'pi kulakumārīnam'pi pacchāliyaṃ khipanti."
8318,apaññatta 1,"yāvakīvañ'ca bhikkhave bhikkhū <b>apaññattaṃ</b> na paññāpessanti, paññattaṃ na samucchindissanti, yathāpaññattesu sikkhāpadesu samādāya vattissanti"
8618,apaṭisevanta,"yañ'hi'ssa, bhikkhave, <b>appaṭisevato</b> uppajjeyyuṃ āsavā vighātapariḷāhā, paṭisevato evaṃsa te āsavā vighātapariḷāhā na honti."
8306,apaṇṇakaṃ,"dumapphalānī'va patanti māṇavā, daharā ca vuḍḍhā ca sarīrabhedā.<br/>etam'pi disvā pabbajito'mhi rāja, <b>apaṇṇakaṃ</b> sāmaññam'eva seyyo."
8631,apattamānasa,ye kho te bhikkhū sekkhā <b>apattamānasā</b> anuttaraṃ yogakkhemaṃ<br/>patthayamānā viharanti tesu me ayaṃ evarūpī anusāsanī hoti.
73079,apatta 2,ye kho te bhikkhū sekkhā apattamānasā anuttaraṃ yogakkhemaṃ<br/>patthayamānā viharanti tesu me ayaṃ evarūpī anusāsanī hoti.
8702,apayanta,"nandopanandabhujagaṃ vibudhaṃ mah'iddhiṃ, puttena therabhujagena dam'<b>āpayanto</b>, iddh'ūpadesavidhinā jitavā mun'indo"
8447,aparihāniya,katame ca bhikkhave satta <b>aparihāniyā</b> dhammā?
8669,apāṭuka,"nekatikā vañcanikā, kūṭa-sakkhī apāṭukā.<br/>bahūhi parikappehi, āmisaṃ paribhuñjare."
8047,apādaka 2,"<b>apādakehi</b> me mettaṃ, mettaṃ dipādakehi me.<br/>catuppadehi me mettaṃ, mettaṃ bahuppadehi me."
8348,apāra 2,"yassa pāraṃ <b>apāraṃ</b> vā, pār'āpāraṃ na vijjati,<br/>vītaddaraṃ visaṃyuttaṃ, tam'ahaṃ brūmi brāhmaṇaṃ."
9247,aputhujjanasevita,"phusāmi nekkhammasukhaṃ, aputhujjanasevitaṃ.<br/>bhikkhu vissāsam'āpādi, appatto āsavakkhayaṃ."
8749,apetaviññāṇa,"aciraṃ vat'ayaṃ kāyo, paṭhaviṃ adhisessati.<br/>chuḍḍho <b>apetaviññāṇo</b>, niratthaṃ'va kaliṅgaraṃ."
9065,appaṭikūlasaññī,"so sace ākaṅkhati – paṭikūle appaṭikūlasaññī vihareyyan'ti, appaṭikūlasaññī tattha viharati."
9042,appaṭigha 1,sanidassanasappaṭighā dhammā. anidassanasappaṭighā dhammā. anidassana-<b>appaṭighā</b> dhammā.
9156,appāya,"sac'āyaṃ kulaputto app'āyo samāno uḷāraṃ jīvikaṃ kappeti, tassa bhavanti vattāro, udumbarakhādikaṃ v'āyaṃ kulaputto bhoge khādatī'ti."
61,abbahe,"pamādo rajo pamādo, pamād'ānupatito rajo,<br/>appamādena vijjāya, <b>abbahe</b> sallam'attano'ti."
1320,abyositatta,"tasmā hi paññā'va dhanena seyyā, yāya vosānam'idh'ādhigacchati.<br/><b>abyositattā</b> hi bhav'ābhavesu, pāpāni kammāni karoti mohā."
537,abhikkantadassāvī,"evaṃ <b>abhikkantadassāviṃ</b>, atthi pañhena āgamaṃ, <br/>kathaṃ lokaṃ avekkhantaṃ, maccurājā na passati."
505,abhijjhitar,"idha cunda ekacco anabhijjhālu hoti. yaṃ taṃ parassa paravitt'ūpakaraṇaṃ taṃ an<b>abhijjhitā</b> hoti, aho vata yaṃ parassa taṃ mamassā'ti"
1091,abhitthavati,yaṃnūn'āhaṃ bhagavantaṃ sammukhā sāruppāya gāthāya <b>abhitthaveyyan</b>'ti.
1096,abhitthuti,handa mayaṃ buddh'<b>ābhitthutiṃ</b> karomase
378,abhidhāna 3,"duggāhadiṭṭhibhujagena sudaṭṭhahatthaṃ, brahmaṃ visuddhijutim'iddhibak'<b>ābhidhānaṃ</b>, ñāṇāgadena vidhinā jitavā mun'indo"
685,abhinikkhamana,"ek'ūnatiṃsatime saṃvacchare maha-<b>abhinikkhamanaṃ</b> nikkhamitvā, chabbassāni mahāpadānaṃ padahitvā"
712,abhinimmita,"bāhuṃ sahassam'<b>abhinimmita</b> sāvudhan'taṃ, grīmekhalaṃ uditaghorasasenamāraṃ, dān'ādidhammavidhinā jitavā mun'indo, tan'tejasā bhavatu te jayamaṅgalāni"
825,abhipīḷita,ekadā dhammarājā pi gelaññen'<b>ābhipīḷito</b> cundattherena taññ'eva bhaṇāpetvāna sādaraṃ sammoditvā ca ābādhā tamhā vuṭṭhāsi ṭhānaso.
850,abhipūjaneyyaka,"icc'evam'ek'anta-<b>abhipūjaneyyakaṃ</b>, vatthuttayaṃ vandayat'ābhisaṅkhataṃ"
851,abhipūjayati,"tam'mayaṃ bhagavantaṃ sadhammaṃ sasaṅghaṃ, imehi sakkārehi yath'ārahaṃ āropitehi <b>abhipūjayāma</b>"
1192,abhiyujjhita,"mār'ātirekam'<b>abhiyujjhita</b>sabbarattiṃ, ghoram'pan'āḷavakam'akkhamathaddhayakkhaṃ, khantīsudantavidhinā jitavā mun'indo."
1007,abhisaṅkharaṇa,"bhante nāgasena, kiṃlakkhaṇā cetanā'ti? cetayitalakkhaṇā, mahārāja, cetanā <b>abhisaṅkharaṇa</b>lakkhaṇā cā'ti."
1234,abhyati,"saṅgho sukhett'<b>ābhyati</b>khettasaññito, yo diṭṭhasanto sugat'ānubodhako, lolappahīno ariyo sumedhaso"
4655,amatadhātu,so tehi dhammehi cittaṃ paṭivāpeti. so tehi dhammehi cittaṃ paṭivāpetvā <b>amatāya</b> <b>dhātuyā</b> cittaṃ upasaṃharati
4629,amara 2,<b>amarā</b>vitakkavaḍḍhanaṃ par'ānudayatāpaṭisaṃyuttavitakkavaḍḍhanaṃ lābhasakkārasilokapaṭisaṃyuttavitakkavaḍḍhanaṃ
4761,ambilagga,"<b>ambil'aggehi</b>'pi, tittak'aggehi'pi, kaṭuk'aggehi'pi, madhur'aggehi'pi, khārikehi'pi, akhārikehi'pi, loṇikehi'pi, aloṇikehi'pi."
12862,ayamahamasmi,"avijjāsamphassajena, bhikkhave, vedayitena phuṭṭhassa assutavato puthujjanassa asmī'ti'pi'ssa hoti; <b>ayam'aham'asmī</b>'ti'pi'ssa hoti"
12855,ayaṃ tattha samayo,"yo pana bhikkhu aññātakaṃ gahapatiṃ vā gahapatāniṃ vā cīvaraṃ viññāpeyya, aññatra samayā, nissaggiyaṃ pācittiyaṃ. tatth'āyaṃ samayo: acchinnacīvaro vā hoti bhikkhu naṭṭha cīvaro vā. <b>ayaṃ tattha samayo</b>."
13007,ayosalākā,"varaṃ, bhikkhave, tattāya ayosalākāya ādittāya sampajjalitāya sajotibhūtāya cakkhu'ndriyaṃ sampalimaṭṭhaṃ, na tv'eva cakkhuviññeyyesu rūpesu anubyañjanaso nimittaggāho."
9475,araṇī,"seyyathā'pi allaṃ kaṭṭhaṃ sasnehaṃ udake nikkhittaṃ. atha puriso āgaccheyya uttar'āraṇiṃ ādāya, aggiṃ abhinibbattessāmi, tejo pātukarissāmī'ti."
9769,arūpāvacara,"tattha katamo āneñj'ābhisaṅkhāro? kusalā cetanā <b>arūp'āvacarā</b>, ayaṃ vuccati āneñj'ābhisaṅkhāro."
4339,alattaka,"<b>alattaka</b>katā pādā, mukhaṃ cuṇṇakamakkhitaṃ. <br/>alaṃ bālassa mohāya, no ca pāragavesino."
4340,alattakakata,"<b>alattakakatā</b> pādā, mukhaṃ cuṇṇakamakkhitaṃ. <br/>alaṃ bālassa mohāya, no ca pāragavesino."
4416,alippamāna,yam'pi tathāgato arahaṃ sammāsambuddho pubb'eva sambodhā anabhisambuddho bodhisatto'va samāno mahato mīḷha-pabbatassa upar'ūpari caṅkamati alippamāno mīḷhena
4365,aleṇa,bhayato upasaggato calato pabhaṅguto adhuvato atāṇato aleṇato asaraṇato rittato tucchato suññato anattato ādīnavato
10132,asaṅkiliṭṭha,saṅkiliṭṭhasaṅkilesikā dhammā. <b>asaṅkiliṭṭha</b>saṅkilesikā dhammā. asaṅkiliṭṭh'āsaṅkilesikā dhammā.
10143,asaṅkuppa,"paccuppannañ'ca yaṃ dhammaṃ, tattha tattha vipassati. asaṃhīraṃ <b>asaṅkuppaṃ</b>, taṃ vidvā manubrūhaye."
10144,asaññā,"tattha katamo upapattibhavo? kāmabhavo, rūpabhavo, arūpabhavo, saññābhavo, <b>asaññā</b>bhavo, n'evasaññān'<b>āsaññā</b>bhavo, ekavokārabhavo, catuvokārabhavo, pañcavokārabhavo"
10184,asantaṃ,"idha bhikkhu santaṃ vā ajjhattaṃ kāmacchandaṃ atthi me ajjhattaṃ kāmacchando'ti pajānāti, <b>asantaṃ</b> vā ajjhattaṃ kāmacchandaṃ n'atthi me ajjhattaṃ kāmacchando'ti pajānāti"
10178,asanta 1.2,"duddadaṃ dadamānānaṃ, dukkaraṃ kamma kubbataṃ.<br/><b>asanto</b> n'ānukubbanti, sataṃ dhammo durannayo"
9950,asamapekkhita,"manāpe rūpe rāgaṃ, amanāpe dosaṃ, asamapekkhite mohan'ti evaṃ rāg'ādikilese anuppādento upekkhakabhāvena sahati."
9981,asaṃkilesika,saṃkiliṭṭhasaṃkilesikā dhammā.<br/>asaṃkiliṭṭhasaṃkilesikā dhammā.<br/>asaṃkiliṭṭh'<b>āsaṃkilesikā</b> dhammā.
9976,asaṃhira,"paccuppannañ'ca yaṃ dhammaṃ, tattha tattha vipassati. <b>asaṃhiraṃ</b> asaṅkuppaṃ, taṃ vidvā m'anubrūhaye."
10760,asukha,adukkham'<b>asukhaṃ</b> vā vedanaṃ vedayamāno adukkham'<b>asukhaṃ</b> vedanaṃ vedayāmī'ti pajānāti
10739,asuci 4,"kathañ'hi nāma tvaṃ, moghapurisa, hatthena upakkamitvā <b>asuciṃ</b> mocessasi!"
10734,asubhataddasa,"aniccaṃ aniccato dakkhuṃ, dukkham'addakkhu dukkhato.<br/>anattani anattā'ti, asubhaṃ <b>asubhat'addasuṃ</b>.<br/>sammādiṭṭhisamādānā, sabbaṃ dukkhaṃ upaccagun'ti"
10352,asekkha 1,sekkhā dhammā. <b>asekkhā</b> dhammā. n'eva sekkhā na-<b>asekkhā</b> dhammā.
10368,asesita,"jīno rath'assaṃ maṇikuṇḍale ca, putte ca dāre ca that'eva jīno.<br/>sabbesu bhogesu asesitesu, kasmā na santappasi sokakāle."
10609,assapuṭa 1,"ahaṃ, bhante, pāpakammaṃ akāsiṃ gārayhaṃ assapuṭaṃ. yena me āyasmanto attamanā honti taṃ karomī'ti."
10610,assapuṭa 2,"seyyathā'pi, bhikkhave, puriso kāḷakaṃ vatthaṃ paridhāya kese pakiritvā assapuṭaṃ khandhe āropetvā mahājanakāyaṃ upasaṅkamitvā"
10682,assayuja 1,"ayaṃ vasabhasaṃvacchare vassānautu. asmiṃ utumhi <b>assayuja</b>māsassa kāḷapakkhe catutthaṃ, ravivāram'idan'ti daṭṭhabbaṃ."
10654,assasitvā,"aho vat'āhaṃ tadantaraṃ jīveyyaṃ yadantaraṃ assasitvā vā passasāmi, passasitvā vā assasāmi, bhagavato sāsanaṃ manasi kareyyaṃ, bahu vata me kataṃ assā'ti"
70961,assasissati,"pītipaṭisaṃvedī <b>assasissāmī</b>'ti sikkhati, pītipaṭisaṃvedī passasissāmī'ti sikkhati."
12126,avaṅkata,evaṃ no ayaṃ amhākaṃ pabbajjā <b>avaṅkatā</b> avañjhā bhavissati saphalā saudrayā.
11901,avacara 2,"kusalā cetanā kām'<b>āvacarā</b> rūp'<b>āvacarā</b> dānamayā sīlamayā bhāvanāmayā, ayaṃ vuccati puññ'ābhisaṅkhāro."
11911,avacchidda,seyyathā'pi puriso medaka-thālikaṃ parihareyya chidda-avachiddaṃ uggharantaṃ paggharantaṃ; evam'evaṃ kho ahaṃ imaṃ kāyaṃ pariharāmi
12322,avatthāsi,dutiyo musalo paripatitvā aññatarassa dārakassa matthake avatthāsi. so kālamakāsi.
73785,avatthukata,tass'eva kho pana pubbe aviddasuno abhijjhā hoti chando sārāgo. sv'āssa pahīno hoti ucchinnamūlo tāla-<b>avatthukato</b> anabhāvaṃkato āyatiṃ anuppādadhammo.
12101,avamaṅgala 1,"sabbe te rogā, sabbe te bhayā, sabbe te antarāyā, sabbe te upaddavā, sabbe te dunnimittā, sabbe te <b>avamaṅgalā</b> vinassantu"
12587,avikkhitta,pharitvāna mettaṃ samettā bhadantā <b>avikkhitta</b>cittā parittaṃ bhaṇantu
12454,avigata,puna caparaṃ idh'ekacco kāye  avītarāgo hoti <b>avigata</b>cchando <b>avigata</b>pemo <b>avigata</b>pipāso <b>avigata</b>pariḷāho <b>avigata</b>taṇho.
12439,avicikicchā,so avicikiccho samāno bhabbo rāgaṃ pahātuṃ dosaṃ pahātuṃ mohaṃ pahātuṃ.
12505,avijjādhātu,"cakkhu'ndriyassa sot'indriyassa ghān'indriyassa jivh'indriyassa kāy'indriyassa. atthi, bhikkhave, mano, atthi dhammā, atthi avijjādhātu."
12438,avīci 2,"asītivassasahass'āyukesu, bhikkhave, manussesu ayaṃ jambudīpo <b>avīci</b> maññe phuṭo bhavissati manussehi, seyyathā'pi naḷavanaṃ vā saravanaṃ vā."
12730,avītikkama,"yo tattha saṃyamo saṃvaro <b>avītikkamo</b>, idaṃ sīlaṃ. yaṃ samādānaṃ taṃ vataṃ. saṃvar'aṭṭhena sīlaṃ, samādān'aṭṭhena vataṃ"
12373,avekkhassu,"suññato lokaṃ avekkhassu, mogharāja sadā sato,<br/>att'ānudiṭṭhiṃ ūhacca, evaṃ maccutaro siyā,<br/>evaṃ lokaṃ avekkhantaṃ, maccurājā na passatī'ti."
3119,ahirīka,"saṅgha-lābhassa bhaṇḍanti, saṅghato paribāhirā.<br/>para-lābho-pajīvantā, ahirīkā na lajjare."
3149,ahorattamatandita,"evaṃ vihārim'ātāpiṃ, <br/><b>ahorattam'atanditaṃ</b>. <br/>taṃ ve bhadd'ekaratto'ti, <br/>santo ācikkhate muni."
2542,āgā,"diṭṭhiñ'ca nissāya anupucchamāno,<br/>samuggahītesu pamoham'<b>āgā</b>,<br/>ito ca n'āddakkhi aṇum'pi saññaṃ,<br/>tasmā tuvaṃ momuhato dahāsi."
1352,ācāragocara,"etha tumhe, āvuso, sīlavā hotha, pātimokkhasaṃvarasaṃvutā viharatha <b>ācāragocara</b>sampannā aṇumattesu vajjesu bhayadassāvino, samādāya sikkhatha sikkhāpadesū'ti"
3333,ājīvikāpakata,"tañ'ca kho etaṃ, bhikkhave, kulaputtā upenti atthavasikā, atthavasaṃ paṭicca; n'eva rāj'ābhinītā, na cor'ābhinītā, na iṇ'aṭṭā, na bhayaṭṭā, na ājīvikāpakatā"
10828,ātāpeti 2,"yassa hi so, bhikkhave, atthāya usukāro tejanaṃ dvīsu alātesu <b>ātāpeyya</b> paritāpeyya ujuṃ kareyya kammaniyaṃ sv'āssa attho abhinipphanno hoti."
